,Speaker,Response
84,BIDEN,"do you believe for a moment what he's telling you, in light of all the lies he’s told you about the whole issue of covid. he still hasn't even acknowledged that he knew this was happening, knew how dangerous it was going to be back in february, and he didn't even tell you. he's on record saying that he panicked, or he just looked at the stock market -- one of the two -- because guess what: a lot of people died, and a lot more are going to die unless he gets a lot smarter.26:35 "
85,TRUMP,"did you use the word smart? so you said you went to delaware state, but you forgot the name of your college. you didn't go to delaware state. you graduated, either the lowest or almost the lowest in your class. don't ever use the word smart with me, don't ever use that word. "
86,BIDEN," oh, give me a break. "
87,TRUMP,"because you know what, there's nothing smart about you, joe. 47 years, you've done nothing. "
88,BIDEN,"well, let's have this debate. you would’ve had --"
89,TRUMP,"let me just tell you something. if you would have had the charge of what i was put through -- i had to close the greatest economy in the history of our country. and by the way, now it's being built again -- "
90,WALLACE,"we’ll talk about the economy in the next segment, sir. "
91,TRUMP,it's going up fast --
92,WALLACE,"okay. when it comes to how the virus has been handled, so far, the two of you have taken very different approaches, and this is going to affect how the virus is handled going forward, by whichever of you ends up becoming the next president. i want to quickly go through several of those reopenings, vice president biden, you have been much more reluctant than president trump about reopening the economy and school. why, sir?"
93,BIDEN,"because he doesn’t have a plan. if i were running, i’d know what the plan is. you've got to provide these businesses the ability to have the money to be able to reopen with a ppe, as well as with sanitation they need. you have to provide --"
94,TRUMP,tell that to nancy pelosi.27:51 
95,BIDEN,will he just shush for a minute. 
96,TRUMP,tell it to nancy pelosi. and schumer.27:59 
97,BIDEN,"nancy pelosi and schumer --  they have a plan. he won't even meet with them. the republicans won't  meet with them in the senate. but he sits in his golf course -- i mean, literally, think about it --"
98,TRUMP,"you probably play more than i do, joe."
99,WALLACE,"what about this question of reopenings, and the fact that --"
100,TRUMP,"well, he wants to shut down this country. and i want to keep it open. and we did great --"
101,BIDEN,you need to shut it down --28:22 
102,TRUMP,"wait a minute. let me shut you down for a second, joe. just for one second.28:26 "
103,TRUMP,"we want to -- he wants to shut down the country. we just went through it. we had to because we didn't know anything about the disease. now, we’ve found that elderly people with heart problems and diabetes and different problems are very, very vulnerable. we learned a lot -- young children aren't, even younger people aren't. we've learned a lot. but he wants to shut it down. more people will be hurt by continuing -- if you look at pennsylvania, if you look at certain states that have been shut down -- they have democrat governors all. one of the reasons they’re shut down is because they want to keep it shut down until after the election. this is political."
104,WALLACE,i wonder what's --
105,TRUMP,"those states, those states are not doing well that are shut down. "
106,WALLACE,"gentlemen, we’re going to go on to another subject. you have begun to increasingly question the effectiveness of masks as a disease preventer, and in fact recently you have cited the, the issue of waiters touching their masks and touching plates. are you questioning the effectiveness of masks? "
107,TRUMP,"no, you have to understand -- if you look, i mean, i have a mask right here. i put the mask on it, you know what i think i need it. as an example, everybody's had a test, and you've had social distancing and all of the things that you have to, but i wear a mask, when needed -- when needed, i wear masks. i don't -- i don’t wear masks like him. every time you see him, he's got a mask. he could be speaking 200 feet away from me, and he shows up with the biggest mask i've ever seen. 29:51 "
108,WALLACE,"vice president biden, go ahead, sir."
109,BIDEN,"look, the way to open businesses is give them the wherewithal to be able to open. we provided money --"
110,WALLACE,"i was asking, sir, about masks. "
111,BIDEN,"oh. masks -- masks make a big difference. his own head of the cdc said if we just wore masks between now -- if everybody wore masks and social distancing between now and january, we'd probably save up to 100,000 lives. it matters, "
112,TRUMP,and they've also said the opposite. they've also said the --
113,BIDEN,no serious person has said the opposite --
114,TRUMP,what about dr. fauci? dr. fauci said the opposite. 
115,BIDEN,he did not say the opposite. 30:27 
116,TRUMP,he said very strongly: masks are not good. then he changed his mind. he's admitted -- i’m ok with masks.
117,WALLACE,"i want to talk about one last subject, because your different approaches have even affected the way that you have campaigned. president trump, you're holding the large rallies, with crowds packed together thousands of people.30:44 "
118,TRUMP,outside.
119,WALLACE,"outside. yes, sir. great. vice president biden, you are holding much smaller events with --"
120,TRUMP,cause nobody will show up.
121,WALLACE,.people with --
122,TRUMP,nobody shows up to his rallies.
123,WALLACE,"in any case, why you’re holding the big rallies, why you're not. you goes first, sir.31:00 "
124,TRUMP,"because people want to hear what i have to say, i mean, 25, 35,000 people show up at airports. we use airports. "
125,WALLACE,"are you not worried about the disease, though, sir. 31:13 "
126,TRUMP,"well, so far we have had no problem whatsoever. it's outside -- that's a big difference according to the experts. and we do them outside, we have tremendous crowds, as you see. i mean every -- and literally on 24 hours notice -- and joe does the circles and has three people some place."
127,BIDEN,"by the way, did you see, one of the last reboot rallies he had -- a reporter came up to him to ask him a question, he said, ‘no no no. stand back. put on your mask, put on a mask. have you been tested? i'm way, way far away from those other people.’ that's what he said. i can't, i'm gonna be okay. he not worried about you. he's not worried about the people out there -- "
128,TRUMP,"we had no negative, no negative effect. we've had no negative effect, and we've had, 35 40,000, people at some of these rallies."
129,WALLACE,just finish off because i want to move on to our next --
130,BIDEN,"yes, i would. he's been totally irresponsible the way in which he has handled the social distancing, and people wearing masks, basically encouraged them not to. and he's a fool on that. "
131,TRUMP,"if you could get the crowds, you would’ve done the same thing, but you can't -- nobody cares, nobody cares."
132,WALLACE,"gentlemen, can we move on to the economy. the economy is, i think it's fair to say, is recovering faster than expected from the shutdown much in the second quarter. the unemployment rate fell to 8.4% last month. the federal reserve says the hit to growth which is going to be there is not going to be nearly as big as they had expected. president trump, you say we are in a v shaped recovery. vice president biden you say it's more of a k shape. what difference does that mean to the american people in terms of the economy. president trump, in this segment, you go first. 32:56 "
133,TRUMP,"so we built the greatest economy in history. we close it down because of the china plague, when the plague came in we closed it down, which was very hard, psychologically to do. he didn't think we should close it down, and he was wrong, again. to me it -- people would be dead now, instead of still 204,000 people is too much, one person is too much, should have never happened from china. but what happened is we've closed it down and now we're reopening, and we're doing record business. we had 10.4 million people in a four month period that we've put back into the workforce. that's a record the likes of which nobody's ever seen before, and he wants to close down the -- he will shut it down again. he will destroy this country, you know, a lot of people, between drugs and alcohol and depression, when you start shutting it down and you take a look at what's happening in some of your democrat run states where they have these tough shutdowns, and i'm telling you it's because they don't want to open it. one of them came out last week, you saw that, said they’ll open up november 9. why november 9? because it's after the election. they think they're hurting us by keeping them closed. they're hurting people. people know what to do. they can social distance, they can wash their hands, they can wear masks -- they can do whatever they want, but they can open these states up. when you look at north carolina, when you look at -- these governors are under siege in michigan and a couple of others. you gotta open the states up. it's not fair. you're talking about almost like being in prison. and you look at what's going on with divorce, look at what's going on with alcoholism and drugs. it's a very, very sad thing. and he'll close down the whole country, this guy will close down the whole country and destroy our country. our country is coming back incredibly well, setting records as it does it. we don't need somebody to come in and say let's shut it down. "
134,WALLACE,"alright, your two minute sir, we're now moved to you. as i, as i said posing the question, the president says it's a v shape recovery, you say it's a k shape recovery. what's the difference? "
135,BIDEN,"the difference is millionaires and billionaires like him, in the middle of covid crisis, have done very well. the billionaires array have made another $300 billion. because of his profligate tax proposal and you only focus on the market. but you folks at home, you folks living in scranton and claymont -- all the small towns and working class towns in america. how well are you doing? this guy paid a total of $750 in taxes. "
136,WALLACE,"i understand. you've agreed to the two minutes, so please let him have them."
137,BIDEN,"i get my time back? the fact is that he is in fact worked on this in a way that he's going to be the first president in the united states to leave office, i mean fewer jobs in his administration than when he became president. fewer jobs than when he became president. the first one in american history. secondly, the people who have lost their jobs are those people who have been on the front lines, those people who have been saving our lives, those people who have went out there dying, people who have been putting themselves in the way to make sure that we could all try to make it. the idea that he is consistent, that we go forward and open when you have almost half the states in america with a significant increase in covid desks and covid cases in the united states of america, and he wants to open it up more. why does he want to open it up? why doesn't he take care of the american -- you can't fix the economy until you fix the covid crisis, and he has no intention of doing anything about making it better for you all at home, in terms of your health and your safety. schools -- why aren't schools open? because it costs a lot of money to open them safely. you know, they were going to give his administration was going to give the teachers and school students masks. then they decided, no, couldn't do that, because it's not a national emergency, not a national emergency. they've done nothing to help small businesses, nothing. they're closing. one is six is now gone. he ought to get on the job, and take care of the needs of the american people, so we can open safely. "
138,WALLACE,"right. your time is up, sir. "
139,TRUMP,i need to respond to that. 
140,WALLACE,"well, you both have two minutes, sir. 37:02 "
141,TRUMP,"excuse me. he made a statement. people want their schools, no, people want their schools open. they don't want to be shut down. they don't want their state shut down. they want their restaurants. i look at new york. it's so sad what's happening in new york, it's almost like a ghost town. and i'm not sure i can ever recover what they've done in new york. people want their places open. they want to get back to their lives. "
142,BIDEN,they want to be safe. 
143,TRUMP,"they’ll be careful. but they want their schools -- i'm the one that brought back football, by the way, i brought it back big ten football. it was me, and i'm very happy to do it. people on all sides are very proud of me, and you don't want to --"
144,WALLACE,"gentlemen, we’re going to get to your economic plans going forward in a moment but first, mr. president, as you well know, there's a new report that in 2016, the year you were elected president, and 2017, your first year as president, that you paid $750 a year in federal income tax, each of those years. i know that you pay a lot of other taxes, but i'm asking you the specific question: is it true that you paid $750 in federal income taxes, each of those two years."
145,TRUMP,"i paid millions of dollars in taxes. millions of dollars of income tax. and let me just tell you, there was a story in one of the papers. i paid $38 million one year. i paid 27 million one year --"
146,BIDEN,show us your tax returns.
147,TRUMP,"i went -- you'll see it as soon as it's finished, you'll see it. you know, what you want to do -- go to the board of elections. there's 118 page or so report that says everything i have, every bank i have -- i'm totally underleveraged because the assets are extremely good, and we have a very, we have a --"
148,WALLACE," i’m asking a specific question, a specific question, which is --"
149,TRUMP,"let me tell you, that i understand --38:49 "
150,WALLACE,"no, mr. president. i'm asking the question. will you tell us how much you paid in federal income taxes in 2016 and 2017?38:59 "
151,TRUMP,millions of dollars. 39:00 
152,WALLACE,you paid millions of dollars? 39:02 
153,TRUMP,millions of dollars. millions of dollars. and you'll get to see it. and you’ll get to see it.39:05 
154,BIDEN,when?39:06 
155,TRUMP,"but let me tell you, chris. let me just say something. it was the tax laws-- i don't want to pay tax. before i came here, i was a private developer. i was a private business people. like every other private person, unless they’re stupid, they go through the laws and that's what it is. he passed a tax bill that gave us all these privileges for depreciation, and for tax credits. we built a building and we get tax credits, like the hotel on pennsylvania avenue. you get an asset, which by the way, was given to me by the obama administration, if you can believe that. now the man got fired up right after that happened but--39:43 "
156,WALLACE,"vice president biden, do you want to respond?39:45 "
157,BIDEN,"i do want to respond. look, the tax code that made him, put him in a position that he pays less tax to the school teacher, make them, the money a school teacher makes. is because of-- he says he's smart because he can take advantage of the tax code. and he does take advantage of the tax code, but that's why i'm going to eliminate the trump tax cuts. and we're going to eliminate those tax cuts and make sure that we invest in the people who, in fact, need the help. people out there need help--40:15 "
158,TRUMP,but why did you do it over the last 25 years? why doesn’t he do it over the last 25 years?40:19 
159,BIDEN,because you were president-- because you were president and destroyed things up. 40:22 
160,TRUMP,you were a senator--40:24 
161,BIDEN,you are the worst president america’s ever had40:26 
162,TRUMP,"let me just say joe i've done more in, in 47 months, i've done more than you've done in 47 years, joe. we've done things that you never even thought of doing, including fixing the broken military that you gave me, to taking care of the vets--40:30 "
163,WALLACE,"we’re talking -- mr. president, we're talking about the economy. i'd like to ask you about your plans going forward. because mr. vice president, your economic plan, if you were to be elected president, focuses a lot on big government. big taxes. big spending. i want to focus first on the taxes. you propose more than $4 trillion over a decade in new taxes on individuals making more than $400,000 a year and on corporations. president trump says that that kind of an increase in taxes is going to hurt the economy as it's just coming out of a recession.41:14 "
164,BIDEN,"well, just take a look at what is the analysis done by wall street firms points out that my economic plan would create 7 million more jobs than his in four years, number one. and number two, it would create an additional $1 trillion in economic growth because it would be about buying american. and we have to. we're gonna make-- the federal government spends $600 billion a year on everything from ships, to steel, to build, to the like. and under my proposal, we're going to make sure that every penny of that has to be made by a--41:50 "
165,WALLACE,"respectfully, sir. i’m talking about taxes, not spending.41:54 "
166,BIDEN,"well, by the way, i'm gonna eliminate a significant number of the tax. i'm gonna make the, the corporate tax 28%, shouldn't be 21%. you have 19 companies--91 companies, federal, i mean in the fortune 500, who don't pay a single penny in tax making billions of dollars. 42:11 "
167,TRUMP,why didn’t you do it when you were vice president with obama?42:15 
168,BIDEN,"because, because you in fact passed that. that was your tax proposal.42:18 "
169,TRUMP,i got it done and you know what happened? our economy boomed like it's never boomed --42:23 
170,WALLACE,"mr. president, mr. president, let me pick up on that. you would continue your free market approach, lower taxes, more deregulation, correct?42:32 "
171,BIDEN,not lower taxes for the american people.42:46 
172,WALLACE,but in obama's economy booming. it turns out that in obama's final three years as president more jobs were created. a million and a half more jobs than in the first three years of your presidency.42:48 
173,TRUMP,"they had the slowest recovery. since 19 -- economic recovery, since 1929. it was the slowest recovery. also, they took over something that was down here. all you have to do is turn on the lights and you pick up a lot, but they had the slowest economic recovery since 1929. let me tell you about the stock market. when the stock market goes up, that means jobs. it also means 401k's. if you got in, if you ever became president with your ideas -- you want to terminate my taxes? i'll tell you what, you’ll lose half of the companies that have poured in here will leave. and plenty of companies that are already here they'll leave for other places. they will leave, and you will have a depression, the likes of which you've never seen.43:29 "
174,BIDEN,"look, we inherited the worst recession, short of a depression, in american history. i was asked to bring it back. we were able to have an economic recovery, the crazy jobs you're talking about. he comes in on a booming economy. he blew it.  he blew it.43:44 "
175,TRUMP, it wasn’t booming. it wasn’t booming.43:49 
176,WALLACE,"sir, wait. wait. is it fair to say he blew it when, when there was record low unemployment before covid?43:57 "
177,BIDEN,"yeah. yeah, because what he did, even before covid, manufacturing went in the hole. manufacturing went in the hole--44:04 "
178,TRUMP,"excuse me, chris. wait, chris. they said it would take?44:05 "
179,BIDEN,"number one, number two, number three --44:09 "
180,TRUMP,"no, you’re number two. chris, chris. 44:12 "
181,BIDEN, this guy --44:13 
182,TRUMP," they said it was a miracle to bring back manufacturing, i brought back 700,000 jobs. they brought back nothing. they gave up on manufacturing --44:20 "
183,BIDEN,we did not give up. i'm the guy who brought back the automobile industry.44:23 
184,TRUMP, he totally gave up on the auto industry --44:24 
185,WALLACE,"alright, let him --44:26 "
186,BIDEN,"we brought back, i was asked to bring back, chrysler and general motors. we brought them back right here in the state of ohio and michigan. he blew it. they're gone. he blew it. and in fact, they're going --44:34 "
187,TRUMP,ohio had the best year it's ever had last year. michigan had the best year they've ever had --44:39 
188,BIDEN,that is not true.44:40 
189,TRUMP,"many car companies came in from germany, from china. they went to michigan, went to ohio.44:47 "
190,WALLACE,mr. vice president --44:48 
191,BIDEN,"and so, you take a look at what he's actually done. he's done very little. his trade deals are the same way. he talks about these great trade deals. you know, he talks about the art of the deal. china's made, perfected the art of the steel. we have a higher deficit with china now than we did before. we have the highest trade deficit with mexico -- 45:06 "
192,TRUMP,china ate your lunch --45:07 
193,WALLACE,"alright, gentlemen --45:09 "
194,TRUMP,"china ate your lunch, joe. no wonder your son goes in and he takes out what he takes out, billions of dollars. takes out billions of dollars to manage. he makes millions of dollars. and also,  while we're at it, why is it, just out of curiosity, the mayor of moscow’s wife gave your son $3.5 million? what did he do to deserve it? what did he do --45:34 "
195,WALLACE,you asked a question. let him answer. 45:36 
196,BIDEN,none of that is true.45:38 
197,TRUMP,"oh, really?45:39 "
198,WALLACE,"mr. president. mr. president, please. you asked a question--45:41 "
199,BIDEN,totally discredited. totally discredited and by the way --45:46 
200,TRUMP,"he did get $3.5 million, joe?45:48 "
201,WALLACE,mr. vice -- mr. president --45:49 
202,TRUMP,he got $3.5 million. 
203,BIDEN,that is not true. 
204,TRUMP,"oh, really?45:52 "
205,WALLACE,"mr. president. it's an, it's an open discussion, please. you --45:55 "
206,TRUMP,no. it’s a fact. 45:57 
207,WALLACE,"well, you’ve raised an issue. let the vice president answer. 45:59 "
208,BIDEN,totally discredit --
209,TRUMP,"-- $183,000a month? with no experience and energy?46:07 "
210,WALLACE,"mr. president, let him answer.46:08 "
211,BIDEN,my son did nothing wrong --46:09 
212,TRUMP,"yes, he did --46:10  "
213,WALLACE,"mr. president, let him answer.46:12 "
214,BIDEN,"he doesn’t want to let me answer because he knows i have the truth. his position has been totally, thoroughly discredited --46:17 "
215,TRUMP,by who? the media. 46:20 
216,BIDEN,"by everyone, well by the media, by our allies, by the world bank, by eh- by everyone has discredited. matter of fact. 46:30  "
217,WALLACE,"mr. president, please stop.46:30 "
218,BIDEN,"matter of fact, even the people who testified under oath. 46:32 "
219,TRUMP,"so let me ask you this --46:39he testified under oath and his administration said, i did my job and i did very well.46:45 "
220,TRUMP,i don’t know who they are -- 46:46 
221,BIDEN,"well i'll give you the list of the people who testified. sir, you’ve already fired most of them because they did their jobs.46:53 "
222,TRUMP,well some people don’t --46:56 
223,WALLACE,"wait a minute, you get the final word.46:57 "
224,BIDEN,"well, it's hard to get any word with this clown, excuse me, this person.47:00 "
225,TRUMP,let me just say -- 47:02 
226,WALLACE,"no, no, mr. president. mr. president.47:06 "
227,BIDEN,that is simply not true.47:07 
228,TRUMP,why did he deserve three and a half million for moscow?47:08 
229,BIDEN,"look, here's the deal. i want to talk about families and ethics. i don't want to do that. i mean his family we could talk about all night. his family --47:18 "
230,TRUMP,"my family, my family lost a fortune coming down and helping us with government and 47:23 "
231,WALLACE,mr. president.47:24 
232,TRUMP,every single one of them lost --47:26 
233,BIDEN,this is not about his family or my family. it’s about your family. 47:30 
234,TRUMP,"three and a half million dollars.47:31 bidenthat's not true. it doesn't want to talk about what you need, you, the american people. it's about you. that's what we're talking about.47:41 "
235,WALLACE,"alright, that's the end of this segment. we're moving on. mr. president --47:47 "
236,TRUMP,can i be honest? it's very important to --47:49 
237,BIDEN,try to be honest.47:50 
238,WALLACE,"no, the answer the question is no. no, i, sir. 47:54 "
239,TRUMP,-- with a billion dollars. 47:56 
240,BIDEN,that is absolutely not true --48:00 
241,WALLACE,"gentleman i hate to raise my voice, but why should i be different than the two of you? so here's the deal, we have six segments. we have ended that segment, we're going to go to the next segment. in that segment, you each are gonna have two uninterrupted moments. in those two interrupted minutes, mr. president, you can say anything you want. i can asked a question about race but if you want to answer about something else, go ahead. but we, i think that the country would be better served if we allowed both people to speak with fewer interruption. i'm appealing to you sir to do that. 48:34 "
242,TRUMP,"well, him too. 48:36 "
243,WALLACE,"well, frankly, you've been doing more interrupting-48:38 "
244,TRUMP,"well that’s alright, but he does plenty. 48:40 "
