,Speaker,Response
33,BROKAW,"all right, gentlemen, i want to just remind you one more time about time. we’re going to have a larger deficit than the federal government does if we don’t get this under control here before too long. (laughter) senator mccain, for you, we have our first question from the internet tonight. a child of the depression, 78-year-old fiora (ph) from chicago. since world war ii, we have never been asked to sacrifice anything to help our country, except the blood of our heroic men and women. as president, what sacrifices — sacrifices will you ask every american to make to help restore the american dream and to get out of the economic morass that we’re now in? "
34,MCCAIN,"well, fiora (ph), i’m going to ask the american people to understand that there are some programs that we may have to eliminate. i first proposed a long time ago that we would have to examine every agency and every bureaucracy of government. and we’re going to have to eliminate those that aren’t working. i know a lot of them that aren’t working. one of them is in defense spending, because i’ve taken on some of the defense contractors. i saved the taxpayers $6.8 billion in a deal for an air force tanker that was done in a corrupt fashion. i believe that we have to eliminate the earmarks. and sometimes those projects, not — not the overhead projector that senator obama asked for, but some of them that are really good projects, will have — will have to be eliminated, as well. and they’ll have to undergo the same scrutiny that all projects should in competition with others. so we’re going to have to tell the american people that spending is going to have to be cut in america. and i recommend a spending freeze that — except for defense, veterans affairs, and some other vital programs, we’ll just have to have across-the-board freeze. and some of those programs may not grow as much as we would like for them to, but we can establish priorities with full transparency, with full knowledge of the american people, and full consultation, not done behind closed doors and shoving earmarks in the middle of the night into programs that we don’t even — sometimes we don’t even know about until months later. and, by the way, i want to go back a second. "
35,MCCAIN,"look, we can attack health care and energy at the same time. we’re not — we’re not — we’re not rifle shots here. we are americans. we can, with the participation of all americans, work together and solve these problems together. frankly, i’m not going to tell that person without health insurance that, “i’m sorry, you’ll have to wait.” i’m going to tell you americans we’ll get to work right away and we’ll get to work together, and we can get them all done, because that’s what america has been doing. "
36,BROKAW,"senator mccain, thank you very much. senator obama? "
37,OBAMA,"you know, a lot of you remember the tragedy of 9/11 and where you were on that day and, you know, how all of the country was ready to come together and make enormous changes to make us not only safer, but to make us a better country and a more unified country. and president bush did some smart things at the outset, but one of the opportunities that was missed was, when he spoke to the american people, he said, “go out and shop.” that wasn’t the kind of call to service that i think the american people were looking for. and so it’s important to understand that the — i think the american people are hungry for the kind of leadership that is going to tackle these problems not just in government, but outside of government. and let’s take the example of energy, which we already spoke about. there is going to be the need for each and every one of us to start thinking about how we use energy. i believe in the need for increased oil production. we’re going to have to explore new ways to get more oil, and that includes offshore drilling. it includes telling the oil companies, that currently have 68 million acres that they’re not using, that either you use them or you lose them. we’re going to have to develop clean coal technology and safe ways to store nuclear energy. but each and every one of us can start thinking about how can we save energy in our homes, in our buildings. and one of the things i want to do is make sure that we’re providing incentives so that you can buy a fuel efficient car that’s made right here in the united states of america, not in japan or south korea, making sure that you are able to weatherize your home or make your business more fuel efficient. and that’s going to require effort from each and every one of us. and the last point i just want to make. i think the young people of america are especially interested in how they can serve, and that’s one of the reasons why i’m interested in doubling the peace corps, making sure that we are creating a volunteer corps all across this country that can be involved in their community, involved in military service, so that military families and our troops are not the only ones bearing the burden of renewing america. that’s something that all of us have to be involved with and that requires some leadership from washington. "
38,BROKAW,"senator obama, as we begin, very quickly, our discussion period, president bush, you’ll remember, last summer, said that “wall street got drunk.” a lot of people now look back and think the federal government got drunk and, in fact, the american consumers got drunk. how would you, as president, try to break those bad habits of too much debt and too much easy credit, specifically, across the board, for this country, not just at the federal level, but as a model for the rest of the country, as well? "
39,OBAMA,"well, i think it starts with washington. we’ve got to show that we’ve got good habits, because if we’re running up trillion dollar debts that we’re passing on to the next generation, then a lot of people are going to think, “well, you know what? there’s easy money out there.” it means — and i have to, again, repeat this. it means looking (ph) at the spending side, but also at the revenue side. i mean, senator mccain has been talking tough about earmarks, and that’s good, but earmarks account for about $18 billion of our budget. now, when senator mccain is proposing tax cuts that would give the average fortune 500 ceo an additional $700,000 in tax cuts, that’s not sharing a burden. and so part of the problem, i think, for a lot of people who are listening here tonight is they don’t feel as if they are sharing the burden with other folks. i mean, you know, it’s tough to ask a teacher who’s making $30,000 or $35,000 a year to tighten her belt when people who are making much more than her are living pretty high on the hog. and that’s why i think it’s important for the president to set a tone that says all of us are going to contribute, all of us are going to make sacrifices, and it means that, yes, we may have to cut some spending, although i disagree with senator mccain about an across-the- board freeze. that’s an example of an unfair burden sharing. that’s using a hatchet to cut the federal budget. "
40,OBAMA,"i want to use a scalpel so that people who need help are getting help and those of us, like myself and senator mccain, who don’t need help, aren’t getting it. that’s how we make sure that everybody is willing to make a few sacrifices. "
41,BROKAW,senator mccain? 
42,MCCAIN,"well, you know, nailing down senator obama’s various tax proposals is like nailing jell-o to the wall. there has been five or six of them and if you wait long enough, there will probably be another one. but he wants to raise taxes. my friends, the last president to raise taxes during tough economic times was herbert hoover, and he practiced protectionism as well, which i’m sure we’ll get to at some point. you know, last year up to this time, we’ve lost 700,000 jobs in america. the only bright spot is that over 300,000 jobs have been created by small businesses. senator obama’s secret that you don’t know is that his tax increases will increase taxes on 50 percent of small business revenue. small businesses across america will have to cut jobs and will have their taxes increase and won’t be able to hire because of senator obama’s tax policies. you know, he said some time ago, he said he would forgo his tax increases if the economy was bad. i’ve got some news, senator obama, the news is bad. so let’s not raise anybody’s taxes, my friends, and make it be very clear to you i am not in favor of tax cuts for the wealthy. i am in favor of leaving the tax rates alone and reducing the tax burden on middle-income americans by doubling your tax exemption for every child from $3,500 to $7,000. to giving every american a $5,000 refundable tax credit and go out and get the health insurance you want rather than mandates and fines for small businesses, as senator obama’s plan calls for. and let’s create jobs and let’s get our economy going again. and let’s not raise anybody’s taxes. "
43,BROKAW,"senator obama, we have another question from the internet. "
44,OBAMA,"tom, can i respond to this briefly? because… "
45,BROKAW,"well, look, guys, the rules were established by the two campaigns, we worked very hard on this. this will address, i think, the next question. "
46,OBAMA,"the tax issue, because i think it’s very important. go ahead. "
47,BROKAW,"there are lots of issues that we are going to be dealing with here tonight. and we have a question from langdon (ph) in ballston spa, new york, and that’s about huge unfunded obligations for social security, medicare, and other entitlement programs that will soon eat up all of the revenue that’s in place and then go into a deficit position. since the rules are pretty loose here, i’m going to add my own to this one. instead of having a discussion, let me ask you as a coda to that. would you give congress a date certain to reform social security and medicare within two years after you take office? because in a bipartisan way, everyone agrees, that’s a big ticking time bomb that will eat us up maybe even more than the mortgage crisis. "
48,OBAMA,"well, tom, we’re going to have to take on entitlements and i think we’ve got to do it quickly. we’re going to have a lot of work to do, so i can’t guarantee that we’re going to do it in the next two years, but i’d like to do in the my first term as president. but i think it’s important to understand, we’re not going to solve social security and medicare unless we understand the rest of our tax policies. and you know, senator mccain, i think the “straight talk express” lost a wheel on that one. so let’s be clear about my tax plan and senator mccain’s, because we’re not going to be able to deal with entitlements unless we understand the revenues coming in. i want to provide a tax cut for 95 percent of americans, 95 percent. if you make less than a quarter of a million dollars a year, you will not see a single dime of your taxes go up. if you make $200,000 a year or less, your taxes will go down. now, senator mccain talks about small businesses. only a few percent of small businesses make more than $250,000 a year. so the vast majority of small businesses would get a tax cut under my plan. and we provide a 50 percent tax credit so that they can buy health insurance for their workers, because there are an awful lot of small businesses that i meet across america that want to do right by their workers but they just can’t afford it. some small business owners, a lot of them, can’t even afford health insurance for themselves. now, in contrast, senator mccain wants to give a $300 billion tax cut, $200 billion of it to the largest corporations and a hundred thousand of it — a hundred billion of it going to people like ceos on wall street. he wants to give average fortune 500 ceo an additional $700,000 in tax cuts. that is not fair. and it doesn’t work. "
49,OBAMA,"now, if we get our tax policies right so that they’re good for the middle class, if we reverse the policies of the last eight years that got us into this fix in the first place and that senator mccain supported, then we are going to be in a position to deal with social security and deal with medicare, because we will have a health care plan that actually works for you, reduces spending and costs over the long term, and social security that is stable and solvent for all americans and not just some. "
50,BROKAW,"senator mccain, two years for a reform of entitlement programs? "
51,MCCAIN,"sure. hey, i’ll answer the question. look — look, it’s not that hard to fix social security, tom. it’s just… "
52,BROKAW,and medicare. 
53,MCCAIN,"… tough decisions. i want to get to medicare in a second. social security is not that tough. we know what the problems are, my friends, and we know what the fixes are. we’ve got to sit down together across the table. it’s been done before. i saw it done with our — our wonderful ronald reagan, a conservative from california, and the liberal democrat tip o’neill from massachusetts. that’s what we need more of, and that’s what i’ve done in washington. senator obama has never taken on his party leaders on a single major issue. i’ve taken them on. i’m not too popular sometimes with my own party, much less his. so medicare, it’s going to be a little tougher. it’s going to be a little tougher because we’re talking about very complex and difficult issues. my friends, what we have to do with medicare is have a commission, have the smartest people in america come together, come up with recommendations, and then, like the base-closing commission idea we had, then we should have congress vote up or down. let’s not let them fool with it anymore. there’s too much special interests and too many lobbyists working there. so let’s have — and let’s have the american people say, “fix it for us.” now, just back on this — on this tax, you know, again, it’s back to our first question here about rhetoric and record. senator obama has voted 94 times to either increase your taxes or against tax cuts. that’s his record. when he ran for the united states senate from illinois, he said he would have a middle-income tax cut. you know he came to the senate and never once proposed legislation to do that? so let’s look at our record. i’ve fought higher taxes. i have fought excess spending. i have fought to reform government. let’s look at our records, my friends, and then listen to my vision for the future of america. and we’ll get our economy going again. and our best days are ahead of us. "
54,BROKAW,"senator mccain, thank you very much. i’m going to stick by my part of the pact and not ask a follow-up here. the next question does come from the hall for senator mccain. it comes from section c over here, and it’s from ingrid jackson (ph). ingrid (ph)? question: senator mccain, i want to know, we saw that congress moved pretty fast in the face of an economic crisis. i want to know what you would do within the first two years to make sure that congress moves fast as far as environmental issues, like climate change and green jobs? "
55,MCCAIN,"well, thank you. look, we are in tough economic times; we all know that. and let’s keep — never forget the struggle that americans are in today. but when we can — when we have an issue that we may hand our children and our grandchildren a damaged planet, i have disagreed strongly with the bush administration on this issue. i traveled all over the world looking at the effects of greenhouse gas emissions, joe lieberman and i. and i introduced the first legislation, and we forced votes on it. that’s the good news, my friends. the bad news is we lost. but we kept the debate going, and we kept this issue to — to posing to americans the danger that climate change opposes. now, how — what’s — what’s the best way of fixing it? nuclear power. senator obama says that it has to be safe or disposable or something like that. look, i — i was on navy ships that had nuclear power plants. nuclear power is safe, and it’s clean, and it creates hundreds of thousands of jobs. and — and i know that we can reprocess the spent nuclear fuel. the japanese, the british, the french do it. and we can do it, too. senator obama has opposed that. we can move forward, and clean up our climate, and develop green technologies, and alternate — alternative energies for — for hybrid, for hydrogen, for battery-powered cars, so that we can clean up our environment and at the same time get our economy going by creating millions of jobs. we can do that, we as americans, because we’re the best innovators, we’re the best producers, and 95 percent of the people who are our market live outside of the united states of america. "
56,BROKAW,senator obama? 
57,OBAMA,this is one of the biggest challenges of our times. 
58,OBAMA,"and it is absolutely critical that we understand this is not just a challenge, it’s an opportunity, because if we create a new energy economy, we can create five million new jobs, easily, here in the united states. it can be an engine that drives us into the future the same way the computer was the engine for economic growth over the last couple of decades. and we can do it, but we’re going to have to make an investment. the same way the computer was originally invented by a bunch of government scientists who were trying to figure out, for defense purposes, how to communicate, we’ve got to understand that this is a national security issue, as well. and that’s why we’ve got to make some investments and i’ve called for investments in solar, wind, geothermal. contrary to what senator mccain keeps on saying, i favor nuclear power as one component of our overall energy mix. but this is another example where i think it is important to look at the record. senator mccain and i actually agree on something. he said a while back that the big problem with energy is that for 30 years, politicians in washington haven’t done anything. what senator mccain doesn’t mention is he’s been there 26 of them. and during that time, he voted 23 times against alternative fuels, 23 times. so it’s easy to talk about this stuff during a campaign, but it’s important for us to understand that it requires a sustained effort from the next president. one last point i want to make on energy. senator mccain talks a lot about drilling, and that’s important, but we have three percent of the world’s oil reserves and we use 25 percent of the world’s oil. so what that means is that we can’t simply drill our way out of the problem. and we’re not going to be able to deal with the climate crisis if our only solution is to use more fossil fuels that create global warming. we’re going to have to come up with alternatives, and that means that the united states government is working with the private sector to fund the kind of innovation that we can then export to countries like china that also need energy and are setting up one coal power plant a week. we’ve got to make sure that we’re giving them the energy that they need or helping them to create the energy that they need. "
59,BROKAW,"gentlemen, you may not have noticed, but we have lights around here. they have red and green and yellow and they are to signal… "
60,OBAMA,i’m just trying to keep up with john. 
61,MCCAIN,"tom, wave like that and i’ll look at you. "
62,BROKAW,"all right, senator. here’s a follow-up to that, one-minute discussion. it’s a simple question. "
63,MCCAIN,sure. 
64,BROKAW,"should we fund a manhattan-like project that develops a nuclear bomb to deal with global energy and alternative energy or should we fund 100,000 garages across america, the kind of industry and innovation that developed silicon valley? "
65,MCCAIN,"i think pure research and development investment on the part of the united states government is certainly appropriate. i think once it gets into productive stages, that we ought to, obviously, turn it over to the private sector. by the way, my friends, i know you grow a little weary with this back-and-forth. it was an energy bill on the floor of the senate loaded down with goodies, billions for the oil companies, and it was sponsored by bush and cheney. you know who voted for it? you might never know. that one. you know who voted against it? me. i have fought time after time against these pork barrel — these bills that come to the floor and they have all kinds of goodies and all kinds of things in them for everybody and they buy off the votes. i vote against them, my friends. i vote against them. but the point is, also, on oil drilling, oil drilling offshore now is vital so that we can bridge the gap. we can bridge the gap between imported oil, which is a national security issue, as well as any other, and it will reduce the price of a barrel of oil, because when people know there’s a greater supply, then the cost of that will go down. that’s fundamental economics. we’ve got to drill offshore, my friends, and we’ve got to do it now, and we can do it. and as far as nuclear power is concerned, again, look at the record. senator obama has approved storage and reprocessing of spent nuclear fuel. and i’ll stop, tom, and you didn’t even wave. thanks. "
66,BROKAW,"thank you very much, senator. next question for you, senator obama, and it comes from the e section over here and it’s from lindsey trellow (ph). lindsey? question: senator, selling health care coverage in america as the marketable commodity has become a very profitable industry. do you believe health care should be treated as a commodity? "
67,OBAMA,"well, you know, as i travel around the country, this is one of the single most frequently asked issues that i get, is the issue of health care. it is breaking family budgets. i can’t tell you how many people i meet who don’t have health insurance. if you’ve got health insurance, most of you have seen your premiums double over the last eight years. and your co-payments and deductibles have gone up 30 percent just in the last year alone. if you’re a small business, it’s a crushing burden. so one of the things that i have said from the start of this campaign is that we have a moral commitment as well as an economic imperative to do something about the health care crisis that so many families are facing. so here’s what i would do. if you’ve got health care already, and probably the majority of you do, then you can keep your plan if you are satisfied with it. you can keep your choice of doctor. we’re going to work with your employer to lower the cost of your premiums by up to $2,500 a year. and we’re going to do it by investing in prevention. we’re going to do it by making sure that we use information technology so that medical records are actually on computers instead of you filling forms out in triplicate when you go to the hospital. that will reduce medical errors and reduce costs. if you don’t have health insurance, you’re going to be able to buy the same kind of insurance that senator mccain and i enjoy as federal employees. because there’s a huge pool, we can drop the costs. and nobody will be excluded for pre-existing conditions, which is a huge problem. now, senator mccain has a different kind of approach. he says that he’s going to give you a $5,000 tax credit. what he doesn’t tell you is that he is going to tax your employer-based health care benefits for the first time ever. so what one hand giveth, the other hand taketh away. he would also strip away the ability of states to provide some of the regulations on insurance companies to make sure you’re not excluded for pre-existing conditions or your mammograms are covered or your maternity is covered. and that is fundamentally the wrong way to go. in fact, just today business organizations like the united states chamber of commerce, which generally are pretty supportive of republicans, said that this would lead to the unraveling of the employer-based health care system. that, i don’t think, is the kind of change that we need. we’ve got to have somebody who is fighting for patients and making sure that you get decent, affordable health care. and that’s something that i’m committed to doing as president. "
68,BROKAW,senator mccain? 
