,Speaker,Response
116,BROKAW,"senator mccain, this question is for you from the internet. it’s from alden (ph) in hewitt, texas. how can we apply pressure to russia for humanitarian issues in an effective manner without starting another cold war? "
117,MCCAIN,"first of all, as i say, i don’t think that — we’re not going to have another cold war with russia. but have no doubt that russia’s behavior is certainly outside the norms of behavior that we would expect for nations which are very wealthy, as russia has become, because of their petro dollars. now, long ago, i warned about vladimir putin. i said i looked into his eyes and saw three letters, a k, a g and a b. he has surrounded himself with former kgb apparatchiks. he has gradually repressed most of the liberties that we would expect for nations to observe, and he has exhibited most aggressive behavior, obviously, in georgia. i said before, watch ukraine. ukraine, right now, is in the sights of vladimir putin, those that want to reassemble the old soviet union. we’ve got to show moral support for georgia. "
118,MCCAIN,"we’ve got to show moral support for ukraine. we’ve got to advocate for their membership in nato. we have to make the russians understand that there are penalties for these this kind of behavior, this kind of naked aggression into georgia, a tiny country and a tiny democracy. and so, of course we want to bring international pressures to bear on russia in hopes that that will modify and eventually change their behavior. now, the g-8 is one of those, but there are many others. but the russians must understand that these kinds of actions and activities are not acceptable and hopefully we will use the leverage, economic, diplomatic and others united with our allies, with our allies and friends in europe who are equally disturbed as we are about their recent behaviors. "
119,BROKAW,senator obama. 
120,MCCAIN,"it will not be a re-ignition of the cold war, but russia is a challenge. "
121,BROKAW,"senator obama? we’re winding down, so if we can keep track of the time. "
122,OBAMA,"well, the resurgence of russia is one of the central issues that we’re going to have to deal with in the next presidency. and for the most part i agree with senator mccain on many of the steps that have to be taken. but we can’t just provide moral support. we’ve got to provide moral support to the poles and estonia and latvia and all of the nations that were former soviet satellites. but we’ve also got to provide them with financial and concrete assistance to help rebuild their economies. georgia in particular is now on the brink of enormous economic challenges. and some say that that’s what putin intended in the first place. the other thing we have to do, though, is we’ve got to see around the corners. we’ve got to anticipate some of these problems ahead of time. you know, back in april, i put out a statement saying that the situation in georgia was unsustainable because you had russian peacekeepers in these territories that were under dispute. and you knew that if the russians themselves were trying to obtain some of these territories or push back against georgia, that that was not a stable situation. so part of the job of the next commander-in-chief, in keeping all of you safe, is making sure that we can see some of the 21st century challenges and anticipate them before they happen. we haven’t been doing enough of that. we tend to be reactive. that’s what we’ve been doing over the last eight years and that has actually made us more safe. that’s part of what happened in afghanistan, where we rushed into iraq and senator mccain and president bush suggested that it wasn’t that important to catch bin laden right now and that we could muddle through, and that has cost us dearly. we’ve got to be much more strategic if we’re going to be able to deal with all of the challenges that we face out there. and one last point i want to make about russia. energy is going to be key in dealing with russia. if we can reduce our energy consumption, that reduces the amount of petro dollars that they have to make mischief around the world. that will strengthen us and weaken them when it comes to issues like georgia. "
123,BROKAW,this requires only a yes or a no. ronald reagan famously said that the soviet union was the evil empire. do you think that russia under vladimir putin is an evil empire? 
124,OBAMA,i think they’ve engaged in an evil behavior and i think that it is important that we understand they’re not the old soviet union but they still have nationalist impulses that i think are very dangerous. 
125,BROKAW,senator mccain? 
126,MCCAIN,maybe. (laughter) 
127,BROKAW,maybe. 
128,MCCAIN,"depends on how we respond to russia and it depends on a lot of things. if i say yes, then that means that we’re reigniting the old cold war. if i say no, it ignores their behavior. obviously energy is going to be a big, big factor. and georgia and ukraine are both major gateways of energy into europe. and that’s one of the reasons why it’s in our interest. but the russians, i think we can deal with them but they’ve got to understand that they’re facing a very firm and determined united states of america that will defend our interests and that of other countries in the world. "
129,BROKAW,"all right. we’re going to try to get in two more questions, if we can. so we have to move along. over in section a, terry chary (ph) — do i have that right, terry? question: senator, as a retired navy chief, my thoughts are often with those who serve our country. i know both candidates, both of you, expressed support for israel. question: if, despite your best diplomatic efforts, iran attacks israel, would you be willing to commit u.s. troops in support and defense of israel? or would you wait on approval from the u.n. security council? "
130,MCCAIN,"well, thank you, terry (ph). and thank you for your service to the country. i want to say, everything i ever learned about leadership i learned from a chief petty officer. and i thank you, and i thank you, my friend. thanks for serving. let — let — let me say that we obviously would not wait for the united nations security council. i think the realities are that both russia and china would probably pose significant obstacles. and our challenge right now is the iranians continue on the path to acquiring nuclear weapons, and it’s a great threat. it’s not just a threat — threat to the state of israel. it’s a threat to the stability of the entire middle east. if iran acquires nuclear weapons, all the other countries will acquire them, too. the tensions will be ratcheted up. what would you do if you were the israelis and the president of a country says that they are — they are determined to wipe you off the map, calls your country a stinking corpse? now, senator obama without precondition wants to sit down and negotiate with them, without preconditions. that’s what he stated, again, a matter of record. i want to make sure that the iranians are put enough — that we put enough pressure on the iranians by joining with our allies, imposing significant, tough sanctions to modify their behavior. and i think we can do that. i think, joining with our allies and friends in a league of democracies, that we can effectively abridge their behavior, and hopefully they would abandon this quest that they are on for nuclear weapons. but, at the end of the day, my friend, i have to tell you again, and you know what it’s like to serve, and you know what it’s like to sacrifice, but we can never allow a second holocaust to take place. "
131,BROKAW,senator obama? 
132,OBAMA,"well, terry, first of all, we honor your service, and we’re grateful for it. we cannot allow iran to get a nuclear weapon. it would be a game-changer in the region. not only would it threaten israel, our strongest ally in the region and one of our strongest allies in the world, but it would also create a possibility of nuclear weapons falling into the hands of terrorists. and so it’s unacceptable. and i will do everything that’s required to prevent it. and we will never take military options off the table. and it is important that we don’t provide veto power to the united nations or anyone else in acting in our interests. it is important, though, for us to use all the tools at our disposal to prevent the scenario where we’ve got to make those kinds of choices. and that’s why i have consistently said that, if we can work more effectively with other countries diplomatically to tighten sanctions on iran, if we can reduce our energy consumption through alternative energy, so that iran has less money, if we can impose the kinds of sanctions that, say, for example, iran right now imports gasoline, even though it’s an oil-producer, because its oil infrastructure has broken down, if we can prevent them from importing the gasoline that they need and the refined petroleum products, that starts changing their cost-benefit analysis. that starts putting the squeeze on them. now, it is true, though, that i believe that we should have direct talks — not just with our friends, but also with our enemies — to deliver a tough, direct message to iran that, if you don’t change your behavior, then there will be dire consequences. if you do change your behavior, then it is possible for you to re-join the community of nations. now, it may not work. but one of the things we’ve learned is, is that when we take that approach, whether it’s in north korea or in iran, then we have a better chance at better outcomes. when president bush decided we’re not going to talk to iran, we’re not going to talk to north korea, you know what happened? iran went from zero centrifuges to develop nuclear weapons to 4,000. north korea quadrupled its nuclear capability. we’ve got to try to have talks, understanding that we’re not taking military options off the table. "
133,BROKAW,"all right, gentlemen, we’ve come to the last question. and you’ll both be interested to know this comes from the internet and it’s from a state that you’re strongly contesting, both of you. it’s from peggy (ph) in amherst, new hampshire. and it has a certain zen-like quality, i’ll give you a fair warning. she says, “what don’t you know and how will you learn it?” (laughter) senator obama, you get first crack at that. "
134,OBAMA,"my wife, michelle, is there and she could give you a much longer list than i do. and most of the time, i learn it by asking her. but, look, the nature of the challenges that we’re going to face are immense and one of the things that we know about the presidency is that it’s never the challenges that you expect. it’s the challenges that you don’t that end up consuming most of your time. but here’s what i do know. i know that i wouldn’t be standing here if it weren’t for the fact that this country gave me opportunity. i came from very modest means. i had a single mom and my grandparents raised me and it was because of the help of scholarships and my grandmother scrimping on things that she might have wanted to purchase and my mom, at one point, getting food stamps in order for us to put food on the table. despite all that, i was able to go to the best schools on earth and i was able to succeed in a way that i could not have succeeded anywhere else in this country. the same is true for michelle and i’m sure the same is true for a lot of you. and the question in this election is: are we going to pass on that same american dream to the next generation? over the last eight years, we’ve seen that dream diminish. wages and incomes have gone down. people have lost their health care or are going bankrupt because they get sick. we’ve got young people who have got the grades and the will and the drive to go to college, but they just don’t have the money. and we can’t expect that if we do the same things that we’ve been doing over the last eight years, that somehow we are going to have a different outcome. we need fundamental change. that’s what’s at stake in this election. that’s the reason i decided to run for president, and i’m hopeful that all of you are prepared to continue this extraordinary journey that we call america. but we’re going to have to have the courage and the sacrifice, the nerve to move in a new direction. thank you. "
135,BROKAW,"senator mccain, you get the last word. senator obama had the opening. you’re last up. "
136,MCCAIN,"well, thank you, tom. and i think what i don’t know is what all of us don’t know, and that’s what’s going to happen both here at home and abroad. the challenges that we face are unprecedented. americans are hurting tonight in a way they have not in our generation. there are challenges around the world that are new and different and there will be different — we will be talking about countries sometime in the future that we hardly know where they are on the map, some americans. so what i don’t know is what the unexpected will be. but i have spent my whole life serving this country. i grew up in a family where my father was gone most of the time because he was at sea and doing our country’s business. my mother basically raised our family. i know what it’s like in dark times. i know what it’s like to have to fight to keep one’s hope going through difficult times. i know what it’s like to rely on others for support and courage and love in tough times. i know what it’s like to have your comrades reach out to you and your neighbors and your fellow citizens and pick you up and put you back in the fight. that’s what america’s all about. i believe in this country. i believe in its future. i believe in its greatness. it’s been my great honor to serve it for many, many years. and i’m asking the american people to give me another opportunity and i’ll rest on my record, but i’ll also tell you, when times are tough, we need a steady hand at the tiller and the great honor of my life was to always put my country first. thank you, tom. "
137,BROKAW,"thank you very much, senator mccain. that concludes tonight’s debate from here in nashville. we want to thank our hosts here at belmont university in nashville and the commission on presidential debates. and you’re in my way of my script there, if you will move. (applause) in addition to everything else, there is one more presidential debate on wednesday, october 15, at hofstra university in new york, moderated by my friend, bob schieffer of “cbs news.” thank you, senator mccain. thank you, senator obama. good night, everyone, from nashville. end transcription by: cq transcriptions/morningside      "
