,Speaker,Response
0,MR. KENNEDY,"good evening, mr. shadel. "
1,MR. SHADEL,"and good evening to you, vice president nixon. "
2,MR. NIXON,"good evening, mr. shadel. "
3,MR. SHADEL,"and now to meet the panel of correspondents. frank mcgee, nbc news; charles van fremd, cbs news; douglass cater, reporter magazine; roscoe drummond, new york herald tribune. now, as you’ve probably noted, the four reporters include a newspaper man and a magazine reporter; these two selected by lot by the press secretaries of the candidates from among the reporters traveling with the candidates. the broadcasting representatives were chosen by their companies. the rules for this evening have been agreed upon by the representatives of both candidates and the radio and television networks and i should like to read them. there will be no opening statements by the candidates nor any closing summation. the entire hour will be devoted to answering questions from the reporters. each candidate to be questioned in turn with opportunity for comment by the other. each answer will be limited to two and one-half minutes, each comment to one and a half minutes. the reporters are free to ask any question they choose on any subject. neither candidate knows what questions will be asked. time alone will dete- determine who will be asked the final question. now the first question is from mr. mcgee and is for senator kennedy. mr. mcgee: senator kennedy, yesterday you used the words “trigger-happy” in referring to vice president richard nixon’s stand on defending the islands of quemoy and matsu. last week on a program like this one, you said the next president would come face to face with a serious crisis in berlin. so the question is: would you take military action to defend berlin? "
4,MR. KENNEDY,"mr. mcgee, we have a contractual right to be in berlin coming out of the conversations at potsdam and of world war ii. that has been reinforced by direct commitments of the president of the united states; it’s been reinforced by a number of other nations under nato. i’ve stated on many occasions that the united states must meet its commitment on berlin. it is a commitment that we have to meet if we’re going to protect the security of western europe. and therefore on this question i don’t think that there is any doubt in the mind of any american; i hope there is not any doubt in the mind of any member of the community of west berlin; i’m sure there isn’t any doubt in the mind of the russians. we will meet our commitments to maintain the freedom and independence of west berlin. "
5,MR. SHADEL,"mr. vice president, do you wish to comment? "
6,MR. NIXON,"yes. as a matter of fact, the statement that senator kennedy made was that – to the effect that there were trigger-happy republicans, that my stand on quemoy and matsu was an indication of trigger-happy republicans. i resent that comment. i resent it because th- it’s an implication that republicans have been trigger-happy and, therefore, would lead this nation into war. i would remind senator kennedy of the past fifty years. i would ask him to name one republican president who led this nation into war. there were three democratic presidents who led us into war. i do not mean by that that one party is a war party and the other party is a peace party. but i do say that any statement to the effect that the republican party is trigger-happy is belied by the record. we had a war when we came into power in 1953. we got rid of that; we’ve kept out of other wars; and certainly that doesn’t indicate that we’re trigger-happy. we’ve been strong, but we haven’t been trigger-happy. as far as berlin is concerned, there isn’t any question about the necessity of defending berlin; the rights of people there to be free; and there isn’t any question about what the united american people – republicans and democrats alike – would do in the event there were an attempt by the communists to take over berlin. "
7,MR. SHADEL,the next question is by mr. von fremd for vice president nixon. 
8,MR. VON FREMD,"mr. vice president, a two-part question concerning the offshore islands in the formosa straits. if you were president and the chinese communists tomorrow began an invasion of quemoy and matsu, would you launch the uh – united states into a war by sending the seventh fleet and other military forces to resist this aggression; and secondly, if the uh – regular conventional forces failed to halt such uh – such an invasion, would you authorize the use of nuclear weapons? "
9,MR. NIXON,"mr. von fremd, it would be completely irresponsible for a candidate for the presidency, or for a president himself, to indicate the course of action and the weapons he would use in the event of such an attack. i will say this: in the event that such an attack occurred and in the event the attack was a prelude to an attack on formosa – which would be the indication today because the chinese communists say over and over again that their objective is not the offshore islands, that they consider them only steppingstones to taking formosa – in the event that their attack then were a prelude to an attack on formosa, there isn’t any question but that the united states would then again, as in the case of berlin, honor our treaty obligations and stand by our ally of formosa. but to indicate in advance how we would respond, to indicate the nature of this response would be incorrect; it would certainly be inappropriate; it would not be in the best interests of the united states. i will only say this, however, in addition: to do what senator kennedy has suggested – to suggest that we will surrender these islands or force our chinese nationalist allies to surrender them in advance – is not something that would lead to peace; it is something that would lead, in my opinion, to war. this is the history of dealing with dictators. this is something that senator kennedy and all americans must know. we tried this with hitler. it didn’t work. he wanted first uh – we know, austria, and then he went on to the sudetenland and then danzig, and each time it was thought this is all that he wanted. now what do the chinese communists want? they don’t want just quemoy and matsu; they don’t want just formosa; they want the world. and the question is if you surrender or indicate in advance that you’re not going to defend any part of the free world, and you figure that’s going to satisfy them, it doesn’t satisfy them. it only whets their appetite; and then the question comes, when do you stop them? i’ve often heard president eisenhower in discussing this question, make the statement that if we once start the process of indicating that this point or that point is not the place to stop those who threaten the peace and freedom of the world, where do we stop them? and i say that those of us who stand against surrender of territory – this or any others – in the face of blackmail, in the s- face of force by the communists are standing for the course that will lead to peace. "
10,MR. SHADEL,"senator kennedy, do you wish to comment? "
11,MR. KENNEDY,"yes. the whole th- the united states now has a treaty – which i voted for in the united states senate in 1955 – to defend formosa and the pescadores island. the islands which mr. nixon is discussing are five or four miles, respectively, off the coast of china. now when senator green, the chairman of the senate foreign relations committee, wrote to the president, he received back on the second of october, 1958 – “neither you nor any other american need feel the u.s. will be involved in military hostilities merely in the defense of quemoy and matsu.” now, that is the issue. i believe we must meet our commitment to uh – formosa. i support it and the pescadores island. that is the present american position. the treaty does not include these two islands. mr. nixon suggests uh – that the united states should go to war if these two islands are attacked. i suggest that if formosa is attacked or the pescadores, or if there’s any military action in any area which indicates an attack on formosa and the pescadores, then of course the united states is at war to defend its treaty. now, i must say what mr. nixon wants to do is commit us – as i understand him, so that we can be clear if there’s a disagreement – he wants us to be committed to the defense of these islands merely as the defense of these islands as free territory, not as part of the defense of formosa. admiral yarnell, the commander of the asiatic fleet, has said that these islands are not worth the bones of a single american. the president of the united states has indicated they are not within the treaty area. they were not within the treaty area when the treaty was passed in fifty-five. we have attempted to persuade chiang kai-shek as late as january of 1959 to reduce the number of troops he has on them. this is a serious issue, and i think we ought to understand completely if we disagree, and if so, where. "
12,MR. SHADEL,"mr. cater has the next question for senator kennedy. mr. cater: senator kennedy, last week you said that before we should hold another summit conference, that it was important that the united states build its strength. modern weapons take quite a long time to build. what sort of prolonged period do you envisage before there can be a summit conference? and do you think that there can be any new initiatives on the grounds of nuclear disarmament uh – nuclear control or weapons control d- uh – during this period? "
13,MR. KENNEDY,"well i think we should st- strengthen our conventional forces, and we should attempt in january, february, and march of next year to increase the airlift capacity of our conventional forces. then i believe that we should move full time on our missile production, particularly on minuteman and on polaris. it may be a long period, but we must – we must get started immediately. now on the question of disarmament, particularly nuclear disarmament, i must say that i feel that another effort should be made by a new administration in january of 1961, to renew negotiations with the soviet union and see whether it’s possible to come to some conclusion which will lessen the chances of contamination of the atmosphere, and also lessen the chances that other powers will begin to possess a nuclear capacity. there are indications, because of new inventions, that ten, fifteen, or twenty nations will have a nuclear capacity – including red china – by the end of the presidential office in 1964. this is extremely serious. there have been many wars in the history of mankind. and to take a chance uh – now be – and not make every effort that we could make to provide for some control over these weapons, i think would be a great mistake. one of my disagreements with the present administration has been that i don’t feel a real effort has been made an this very sensitive subject, not only of nuclear controls, but also of general disarmament. less than a hundred people have been working throughout the entire federal government on this subject, and i believe it’s been reflected in our success and failures at geneva. now, we may not succeed. the soviet union may not agree to an inspection system. we may be able to get satisfactory assurances. it may be necessary for us to begin testing again. but i hope the next administration – and if i have anything to do with it, the next administration will – make one last great effort to provide for control of nuclear testing, control of nuclear weapons, if possible, control of outer space, free from weapons, and also to begin again the subject of general disarmament levels. these must be done. if we cannot succeed, then we must strengthen ourselves. but i would make the effort because i think the fate not only of our own civilization, but i think the fate of world and the future of the human race is involved in preventing a nuclear war. "
14,MR. SHADEL,"mr. vice president, your comment? "
15,MR. NIXON,"yes. i am going to make a major speech on this whole subject next week before the next debate, and i will have an opportunity then to answer any other questions that may arise with regard to my position on it. there isn’t any question but that we must move forward in every possible way to reduce the danger of war; to move toward controlled disarmament; to control tests; but also let’s have in mind this: when senator kennedy suggests that we haven’t been making an effort, he simply doesn’t know what he’s talking about. it isn’t a question of the number of people who are working in an administration. it’s a question of who they are. this has been one of the highest level operations in the whole state department right under the president himself. we have gone certainly the extra mile and then some in making offers to the soviet union on control of tests, on disarmament, and in every other way. and i just want to make one thing very clear. yes, we should make a great effort. but under no circumstances must the united states ever make an agreement based on trust. there must be an absolute guarantee. now, just a comment on senator kennedy’s last answer. he forgets that in this same debate on the formosa resolution, which he said he voted for – which he did – that he voted against an amendment, or was recorded against an amendment – and on this particular – or for an amendment, i should say – which passed the senate overwhelmingly, seventy to twelve. and that amendment put the senate of the united states on record with a majority of the senator’s own party voting for it, as well as the majority of republicans – put them on record – against the very position that the senator takes now of surrendering, of indicating in advance, that the united states will not defend the offshore islands. "
16,MR. SHADEL,the next question is by mr. drummond for vice president nixon. 
17,MR. DRUMMOND,"mr. nixon, i would like to ask eh – one more aspect or raise another aspect of this same question. uh – it is my understanding that president eisenhower never advocated that quemoy and matsu should be defended under all circumstances as a matter of principle. i heard secretary dulles at a press conference in fifty-eight say that he thought that it was a mistake for chiang kai-shek to deploy troops to these islands. i would like to ask what has led you to take what appears to be a different position on this subject. "
18,MR. NIXON,"well mr. drummond, first of all, referring to secretary dulles’ press conference, i think if you read it all – and i know that you have – you will find that secretary dulles also indicated in that press conference that when the troops were withdrawn from quemoy, that the implication was certainly of everything that he said, that quemoy could better be defended. there were too many infantrymen there, not enough heavy artillery; and certainly i don’t think there was any implication in secretary dulles’ statement that quemoy and matsu should not be defended in the event that they were attacked, and that attack was a preliminary to an attack on formosa. now as far as president eisenhower is concerned, i have often heard him discuss this question. as i uh – related a moment ago, the president has always indicated that we must not make the mistake in dealing with the dictator of indicating that we are going to make a concession at the point of a gun. whenever you do that, inevitably the dictator is encouraged to try it again. so first it will be quemoy and matsu, next it may be formosa. what do we do then? my point is this: that once you do this – follow this course of action – of indicating that you are not going to defend a particular area, the inevitable result is that it encourages a man who is determined to conquer the world to press you to the point of no return. and that means war. we went through this tragic experience leading to world war ii. we learned our lesson again in korea, we must not learn it again. that is why i think the senate was right, including a majority of the democrats, a majority of the republicans, when they rejected senator kennedy’s position in 1955. and incidentally, senator johnson was among those who rejected that position – voted with the seventy against the twelve. the senate was right because they knew the lesson of history. and may i say, too, that i would trust that senator kennedy would change his position on this – change it; because as long as he as a major presidential candidate continues to suggest that we are going to turn over these islands, he is only encouraging the aggressors – the chinese communist and the soviet aggressors – to press the united states, to press us to the point where war would be inevitable. the road to war is always paved with good intentions. and in this instance the good intentions, of course, are a desire for peace. but certainly we’re not going to have peace by giving in and indicating in advance that we are not going to defend what has become a symbol of freedom. "
19,MR. SHADEL,senator kennedy. 
20,MR. KENNEDY,"i don’t think it’s possible for mr. nixon to state the record in distortion of the facts with more precision than he just did. in 1955, mr. dulles at a press conference said: “the treaty that we have with the republic of china excludes quemoy and matsu from the treaty area.” that was done with much thought and deliberation. therefore that treaty does not commit the united states to defend anything except formosa and the pescadores, and to deal with acts against that treaty area. i completely sustained the treaty. i voted for it. i would take any action necessary to defend the treaty, formosa, and the pescadores island. what we’re now talking about is the vice president’s determination to guarantee quemoy and matsu, which are four and five miles off the coast of red china, which are not within the treaty area. i do not suggest that chiang kai-shek – and this administration has been attempting since 1955 to persuade chiang kai-shek to lessen his troop commitments. uh – he sent a mission – the president – in 1955 of mr. uh – robertson and admiral radford. general twining said they were still doing it in 1959. general ridgway said – who was chief of staff: “to go to war for quemoy and matsu to me would seem an unwarranted and tragic course to take. to me that concept is completely repugnant.” so i stand with them. i stand with the secretary of state, mr. herter, who said these islands were indefensible. i believe that we should meet our commitments, and if the chinese communists attack the pescadores and formosa, they know that it will mean a war. i would not ho- hand over these islands under any point of gun. but i merely say that the treaty is quite precise and i sustain the treaty. mr. nixon would add a guarantee to islands five miles off the coast of the re- republic of china when he’s never really protested the communists seizing cuba, ninety miles off the coast of the united states. "
21,MR. SHADEL,mr. von fremd has a question for senator kennedy. 
22,MR. VON FREMD,"senator kennedy, i’d like to uh – shift the conversation, if i may, to a domestic uh – political argument. the chairman of the republican national committee, senator thruston morton, declared earlier this week that you owed vice president nixon and the republican party a public apology for some strong charges made by former president harry truman, who bluntly suggested where the vice president and the republican party could go. do you feel that you owe the vice president an apology? "
23,MR. KENNEDY,"well, i must say that uh – mr. truman has uh – his methods of expressing things; he’s been in politics for fifty years; he’s been president of the united states. they may – are not my style. but i really don’t think there’s anything that i could say to president truman that’s going to cause him, at the age of seventy-six, to change his particular speaking manner. perhaps mrs. truman can, but i don’t think i can. i’ll just have to tell mr. morton that. if you’d pass that message on to him. "
24,MR. SHADEL,"any comment, mr. vice president? "
25,MR. NIXON,"yes, i think so. of course, both er – senator kennedy and i have felt mr. truman’s ire; and uh – consequently, i think he can speak with some feeling on this subject. i just do want to say one thing, however. we all have tempers; i have one; i’m sure senator kennedy has one. but when a man’s president of the united states, or a former president, he has an obligation not to lose his temper in public. one thing i’ve noted as i’ve traveled around the country are the tremendous number of children who come out to see the presidential candidates. i see mothers holding their babies up, so that they can see a man who might be president of the united states. i know senator kennedy sees them, too. it makes you realize that whoever is president is going to be a man that all the children of america will either look up to, or will look down to. and i can only say that i’m very proud that president eisenhower restored dignity and decency and, frankly, good language to the conduct of the presidency of the united states. and i only hope that, should i win this election, that i could approach president eisenhower in maintaining the dignity of the office; in seeing to it that whenever any mother or father talks to his child, he can look at the man in the white house and, whatever he may think of his policies, he will say: “well, there is a man who maintains the kind of standards personally that i would want my child to follow.” "
26,MR. SHADEL,"mr. cater’s question is for vice president nixon. mr. cater: mr. vice president, i’d like to return just once more, if i may, to this area of dealing with the communists. critics have claimed that on at least three occasions in recent years – on the sending of american troops to indochina in 1954, on the matter of continuing the u-2 flights uh – in may, and then on this definition of the – of our commitment to the offshore island – that you have overstated the administration position, that you have taken a more bellicose position than president eisenhower. just two days ago you said that you called on uh – senator kennedy to serve notice to communist aggressors around the world that we’re not going to retreat one inch more any place, where as we did retreat from the tachen islands, or at least chiang kai-shek did. would you say this was a valid criticism of your statement of foreign policy? "
27,MR. NIXON,"well, mr. cater, of course it’s a criticism that uh – is being made. uh – i obviously don’t think it’s valid. i have supported the administration’s position and i think that that position has been correct; i think my position has been correct. as far as indochina was concerned, i stated over and over again that it was essential during that period that the united states make it clear that we would not tolerate indochina falling under communist domination. now, as a result of our taking the strong stand that we did, the civil war there was ended; and today, at least in the south of indochina, the communists have moved out and we do have a strong, free bastion there. now, looking to the u-2 flights, i would like to point out that i have been supporting the president’s position throughout. i think the president was correct in ordering these flights. i think the president was correct, certainly, in his decision to continue the flights while the conference was going on. i noted, for example, in reading a – uh – a – a particular discussion that senator kennedy had with dave garroway shortly after the uh – his statement about regrets, that uh – he made the statement that he felt that these particular flights uh – were ones that shouldn’t have occurred right at that time, and the indication was how would mr. khrushchev had felt if we had uh – had a flight over the uni- how would we have felt if mr. khrushchev ha – uh – had a flight over the united states while uh – he was visiting here. and the answer, of course, is that communist espionage goes on all the time. the answer is that the united states can’t afford to have a es- an es – a espionage lack or should we s- uh – lag – or should i say uh – an intelligence lag – any more than we can afford to have a missile lag. now, referring to your question with regard to quemoy and matsu. what i object to here is the constant reference to surrendering these islands. senator kennedy quotes the record, which he read from a moment ago, but what he forgets to point out is that the key vote – a uh – vote which i’ve referred to several times – where he was in the minority was one which rejected his position. now, why did they reject it? for the very reason that those senators knew, as the president of the united states knew, that you should not indicate to the communists in advance that you’re going to surrender an area that’s free. why? because they know as senator kennedy will have to know that if you do that you encourage them to more aggression. "
28,MR. SHADEL,senator kennedy? 
