,Speaker,Response
0,BROKAW,"good evening from belmont university in nashville, tennessee. i’m tom brokaw of nbc news. and welcome to this second presidential debate, sponsored by the commission on presidential debates. tonight’s debate is the only one with a town hall format. the gallup organization chose 80 uncommitted voters from the nashville area to be here with us tonight. and earlier today, each of them gave me a copy of their question for the candidates. from all of these questions — and from tens of thousands submitted online — i have selected a long list of excellent questions on domestic and foreign policy. neither the commission nor the candidates have seen the questions. and although we won’t be able to get to all of them tonight, we should have a wide-ranging discussion one month before the election. each candidate will have two minutes to respond to a common question, and there will be a one-minute follow-up. the audience here in the hall has agreed to be polite, and attentive, no cheering or outbursts. those of you at home, of course, are not so constrained. the only exception in the hall is right now, as it is my privilege to introduce the candidates, senator barack obama of illinois and senator john mccain of arizona. gentlemen? (applause) gentlemen, we want to get underway immediately, if we can. since you last met at ole miss 12 days ago, the world has changed a great deal, and not for the better. we still don’t know where the bottom is at this time. as you might expect, many of the questions that we have from here in the hall tonight and from online have to do with the american economy and, in fact, with global economic conditions. i understand that you flipped a coin. and, senator obama, you will begin tonight. and we’re going to have our first question from over here in section a from alan schaefer (ph). alan (ph)? question: with the economy on the downturn and retired and older citizens and workers losing their incomes, what’s the fastest, most positive solution to bail these people out of the economic ruin? "
1,OBAMA,"well, alan (ph), thank you very much for the question. i want to first, obviously, thank belmont university, tom, thank you, and to all of you who are participating tonight and those of you who sent e-mail questions in. i think everybody knows now we are in the worst financial crisis since the great depression. and a lot of you i think are worried about your jobs, your pensions, your retirement accounts, your ability to send your child or your grandchild to college. and i believe this is a final verdict on the failed economic policies of the last eight years, strongly promoted by president bush and supported by senator mccain, that essentially said that we should strip away regulations, consumer protections, let the market run wild, and prosperity would rain down on all of us. it hasn’t worked out that way. and so now we’ve got to take some decisive action. "
2,OBAMA,"now, step one was a rescue package that was passed last week. we’ve got to make sure that works properly. and that means strong oversight, making sure that investors, taxpayers are getting their money back and treated as investors. it means that we are cracking down on ceos and making sure that they’re not getting bonuses or golden parachutes as a consequence of this package. and, in fact, we just found out that aig, a company that got a bailout, just a week after they got help went on a $400,000 junket. and i’ll tell you what, the treasury should demand that money back and those executives should be fired. but that’s only step one. the middle-class need a rescue package. and that means tax cuts for the middle-class. it means help for homeowners so that they can stay in their homes. it means that we are helping state and local governments set up road projects and bridge projects that keep people in their jobs. and then long-term we’ve got to fix our health care system, we’ve got to fix our energy system that is putting such an enormous burden on families. you need somebody working for you and you’ve got to have somebody in washington who is thinking about the middle class and not just those who can afford to hire lobbyists. "
3,BROKAW,senator mccain? 
4,MCCAIN,"well, thank you, tom. thank you, belmont university. and senator obama, it’s good to be with you at a town hall meeting. and, alan (ph), thank you for your question. you go to the heart of america’s worries tonight. americans are angry, they’re upset, and they’re a little fearful. it’s our job to fix the problem. now, i have a plan to fix this problem and it has got to do with energy independence. we’ve got to stop sending $700 billion a year to countries that don’t want us very — like us very much. we have to keep americans’ taxes low. all americans’ taxes low. let’s not raise taxes on anybody today. we obviously have to stop this spending spree that’s going on in washington. do you know that we’ve laid a $10 trillion debt on these young americans who are here with us tonight, $500 billion of it we owe to china? we’ve got to have a package of reforms and it has got to lead to reform prosperity and peace in the world. and i think that this problem has become so severe, as you know, that we’re going to have to do something about home values. you know that home values of retirees continues to decline and people are no longer able to afford their mortgage payments. as president of the united states, alan, i would order the secretary of the treasury to immediately buy up the bad home loan mortgages in america and renegotiate at the new value of those homes — at the diminished value of those homes and let people be able to make those — be able to make those payments and stay in their homes. is it expensive? yes. but we all know, my friends, until we stabilize home values in america, we’re never going to start turning around and creating jobs and fixing our economy. and we’ve got to give some trust and confidence back to america. i know how the do that, my friends. and it’s my proposal, it’s not senator obama’s proposal, it’s not president bush’s proposal. but i know how to get america working again, restore our economy and take care of working americans. thank you. "
5,BROKAW,"senator, we have one minute for a discussion here. obviously the powers of the treasury secretary have been greatly expanded. the most powerful officer in the cabinet now. hank paulson says he won’t stay on. who do you have in mind to appoint to that very important post? senator mccain? "
6,MCCAIN,"not you, tom. (laughter) "
7,BROKAW,"no, with good reason. "
8,MCCAIN,"you know, that’s a tough question and there’s a lot of qualified americans. but i think the first criteria, tom, would have to be somebody who immediately americans identify with, immediately say, we can trust that individual. a supporter of senator obama’s is warren buffett. he has already weighed in and helped stabilize some of the difficulties in the markets and with companies and corporations, institutions today. i like meg whitman, she knows what it’s like to be out there in the marketplace. she knows how to create jobs. meg whitman was ceo of a company that started with 12 people and is now 1.3 million people in america make their living off ebay. maybe somebody here has done a little business with them. but the point is it’s going to have to be somebody who inspires trust and confidence. because the problem in america today to a large extent, tom, is that we don’t have trust and confidence in our institutions because of the corruption on wall street and the greed and excess and the cronyism in washington, d.c. "
9,BROKAW,"all right. senator mccain — senator obama, who do you have in mind for treasury secretary? "
10,OBAMA,"well, warren would be a pretty good choice — warren buffett, and i’m pleased to have his support. but there are other folks out there. the key is making sure that the next treasury secretary understands that it’s not enough just to help those at the top. prosperity is not just going to trickle down. we’ve got to help the middle class. "
11,OBAMA,"and we’ve — you know, senator mccain and i have some fundamental disagreements on the economy, starting with senator mccain’s statement earlier that he thought the fundamentals of the economy were sound. part of the problem here is that for many of you, wages and incomes have flat-lined. for many of you, it is getting harder and harder to save, harder and harder to retire. and that’s why, for example, on tax policy, what i want to do is provide a middle class tax cut to 95 percent of working americans, those who are working two jobs, people who are not spending enough time with their kids, because they are struggling to make ends meet. senator mccain is right that we’ve got to stabilize housing prices. but underlying that is loss of jobs and loss of income. that’s something that the next treasury secretary is going to have to work on. "
12,BROKAW,"senator obama, thank you very much. may i remind both of you, if i can, that we’re operating under rules that you signed off on and when we have a discussion, it really is to be confined within about a minute or so. we’re going to go now, senator mccain, to the next question from you from the hall here, and it comes from oliver clark (ph), who is over here in section f. oliver? question: well, senators, through this economic crisis, most of the people that i know have had a difficult time. and through this bailout package, i was wondering what it is that’s going to actually help those people out. "
13,MCCAIN,"well, thank you, oliver, and that’s an excellent question, because as you just described it, bailout, when i believe that it’s rescue, because — because of the greed and excess in washington and wall street, main street was paying a very heavy price, and we know that. i left my campaign and suspended it to go back to washington to make sure that there were additional protections for the taxpayer in the form of good oversight, in the form of taxpayers being the first to be paid back when our economy recovers — and it will recover — and a number of other measures. but you know, one of the real catalysts, really the match that lit this fire was fannie mae and freddie mac. i’ll bet you, you may never even have heard of them before this crisis. but you know, they’re the ones that, with the encouragement of senator obama and his cronies and his friends in washington, that went out and made all these risky loans, gave them to people that could never afford to pay back. and you know, there were some of us that stood up two years ago and said we’ve got to enact legislation to fix this. we’ve got to stop this greed and excess. meanwhile, the democrats in the senate and some — and some members of congress defended what fannie and freddie were doing. they resisted any change. meanwhile, they were getting all kinds of money in campaign contributions. senator obama was the second highest recipient of fannie mae and freddie mac money in history — in history. so this rescue package means that we will stabilize markets, we will shore up these institutions. but it’s not enough. that’s why we’re going to have to go out into the housing market and we’re going to have to buy up these bad loans and we’re going to have to stabilize home values, and that way, americans, like alan, can realize the american dream and stay in their home. but fannie and freddie were the catalysts, the match that started this forest fire. there were some of us — there were some of us that stood up against it. there were others who took a hike. "
14,BROKAW,senator obama? 
15,OBAMA,"well, oliver, first, let me tell you what’s in the rescue package for you. right now, the credit markets are frozen up and what that means, as a practical matter, is that small businesses and some large businesses just can’t get loans. if they can’t get a loan, that means that they can’t make payroll. if they can’t make payroll, then they may end up having to shut their doors and lay people off. and if you imagine just one company trying to deal with that, now imagine a million companies all across the country. so it could end up having an adverse effect on everybody, and that’s why we had to take action. but we shouldn’t have been there in the first place. now, i’ve got to correct a little bit of senator mccain’s history, not surprisingly. let’s, first of all, understand that the biggest problem in this whole process was the deregulation of the financial system. senator mccain, as recently as march, bragged about the fact that he is a deregulator. on the other hand, two years ago, i said that we’ve got a sub-prime lending crisis that has to be dealt with. i wrote to secretary paulson, i wrote to federal reserve chairman bernanke, and told them this is something we have to deal with, and nobody did anything about it. a year ago, i went to wall street and said we’ve got to reregulate, and nothing happened. "
16,OBAMA,"and senator mccain during that period said that we should keep on deregulating because that’s how the free enterprise system works. now, with respect to fannie mae, what senator mccain didn’t mention is the fact that this bill that he talked about wasn’t his own bill. he jumped on it a year after it had been introduced and it never got passed. and i never promoted fannie mae. in fact, senator mccain’s campaign chairman’s firm was a lobbyist on behalf of fannie mae, not me. so — but, look, you’re not interested in hearing politicians pointing fingers. what you’re interested in is trying to figure out, how is this going to impact you? this is not the end of the process; this is the beginning of the process. and that’s why it’s going to be so important for us to work with homeowners to make sure that they can stay in their homes. the secretary already has the power to do that in the rescue package, but it hasn’t been exercised yet. and the next president has to make sure that the next treasury secretary is thinking about how to strengthen you as a home buyer, you as a homeowner, and not simply think about bailing out banks on wall street. "
17,BROKAW,"senator obama, time for a discussion. i’m going to begin with you. are you saying to mr. clark (ph) and to the other members of the american television audience that the american economy is going to get much worse before it gets better and they ought to be prepared for that? "
18,OBAMA,"no, i am confident about the american economy. but we are going to have to have some leadership from washington that not only sets out much better regulations for the financial system. the problem is we still have a archaic, 20th-century regulatory system for 21st-century financial markets. we’re going to have to coordinate with other countries to make sure that whatever actions we take work. but most importantly, we’re going to have to help ordinary families be able to stay in their homes, make sure that they can pay their bills, deal with critical issues like health care and energy, and we’re going to have to change the culture in washington so that lobbyists and special interests aren’t driving the process and your voices aren’t being drowned out. "
19,BROKAW,"senator mccain, in all candor, do you think the economy is going to get worse before it gets better? "
20,MCCAIN,"i think it depends on what we do. i think if we act effectively, if we stabilize the housing market — which i believe we can, if we go out and buy up these bad loans, so that people can have a new mortgage at the new value of their home — i think if we get rid of the cronyism and special interest influence in washington so we can act more effectively. my friend, i’d like you to see the letter that a group of senators and i wrote warning exactly of this crisis. senator obama’s name was not on that letter. the point is — the point is that we can fix our economy. americans’ workers are the best in the world. they’re the fundamental aspect of america’s economy. they’re the most innovative. they’re the best — they’re most — have best — we’re the best exporters. we’re the best importers. they’re most effective. they are the best workers in the world. and we’ve got to give them a chance. they’ve got — we’ve got to give them a chance to do their best again. and they are the innocent bystanders here in what is the biggest financial crisis and challenge of our time. we can do it. "
21,BROKAW,"thank you, senator mccain. we’re going to continue over in section f, as it turns out. senator obama, this is a question from you from theresa finch (ph). theresa (ph)? question: how can we trust either of you with our money when both parties got — got us into this global economic crisis? "
22,OBAMA,"well, look, i understand your frustration and your cynicism, because while you’ve been carrying out your responsibilities — most of the people here, you’ve got a family budget. if less money is coming in, you end up making cuts. maybe you don’t go out to dinner as much. maybe you put off buying a new car. that’s not what happens in washington. and you’re right. there is a lot of blame to go around. but i think it’s important just to remember a little bit of history. when george bush came into office, we had surpluses. and now we have half-a-trillion-dollar deficit annually. when george bush came into office, our debt — national debt was around $5 trillion. it’s now over $10 trillion. we’ve almost doubled it. and so while it’s true that nobody’s completely innocent here, we have had over the last eight years the biggest increases in deficit spending and national debt in our history. and senator mccain voted for four out of five of those george bush budgets. so here’s what i would do. i’m going to spend some money on the key issues that we’ve got to work on. "
23,OBAMA,"you know, you may have seen your health care premiums go up. we’ve got to reform health care to help you and your budget. we are going to have to deal with energy because we can’t keep on borrowing from the chinese and sending money to saudi arabia. we are mortgaging our children’s future. we’ve got to have a different energy plan. we’ve got to invest in college affordability. so we’re going to have to make some investments, but we’ve also got to make spending cuts. and what i’ve proposed, you’ll hear senator mccain say, well, he’s proposing a whole bunch of new spending, but actually i’m cutting more than i’m spending so that it will be a net spending cut. the key is whether or not we’ve got priorities that are working for you as opposed to those who have been dictating the policy in washington lately, and that’s mostly lobbyists and special interests. we’ve got to put an end to that. "
24,BROKAW,senator mccain? 
25,MCCAIN,"well, theresa (ph), thank you. and i can see why you feel that cynicism and mistrust, because the system in washington is broken. and i have been a consistent reformer. i have advocated and taken on the special interests, whether they be the big money people by reaching across the aisle and working with senator feingold on campaign finance reform, whether it being a variety of other issues, working with senator lieberman on trying to address climate change. i have a clear record of bipartisanship. the situation today cries out for bipartisanship. senator obama has never taken on his leaders of his party on a single issue. and we need to reform. and so let’s look at our records as well as our rhetoric. that’s really part of your mistrust here. and now i suggest that maybe you go to some of these organizations that are the watchdogs of what we do, like the citizens against government waste or the national taxpayers union or these other organizations that watch us all the time. i don’t expect you to watch every vote. and you know what you’ll find? this is the most liberal big-spending record in the united states senate. i have fought against excessive spending and outrages. i have fought to reduce the earmarks and eliminate them. do you know that senator obama has voted for — is proposing $860 billion of new spending now? new spending. do you know that he voted for every increase in spending that i saw come across the floor of the united states senate while we were working to eliminate these pork barrel earmarks? he voted for nearly a billion dollars in pork barrel earmark projects, including, by the way, $3 million for an overhead projector at a planetarium in chicago, illinois. my friends, do we need to spend that kind of money? i think you have to look at my record and you have to look at his. then you have to look at our proposals for our economy, not $860 billion in new spending, but for the kinds of reforms that keep people in their jobs, get middle-income americans working again, and getting our economy moving again. you’re going to be examining our proposals tonight and in the future, and energy independence is a way to do that, is one of them. and drilling offshore and nuclear power are two vital elements of that. and i’ve been supporting those and i know how to fix this economy, and eliminate our dependence on foreign oil, and stop sending $700 billion a year overseas. "
26,BROKAW,"we’ve run out of time. we have this one-minute discussion period going on here. there are new economic realities out there that everyone in this hall and across this country understands that there are going to have to be some choices made. health policies, energy policies, and entitlement reform, what are going to be your priorities in what order? which of those will be your highest priority your first year in office and which will follow in sequence? senator mccain? "
27,MCCAIN,the three priorities were health… 
28,BROKAW,"the three — health care, energy, and entitlement reform: social security and medicare. in what order would you put them in terms of priorities? "
29,MCCAIN,"i think you can work on all three at once, tom. i think it’s very important that we reform our entitlement programs. my friends, we are not going to be able to provide the same benefit for present-day workers that we are going — that present-day retirees have today. we’re going to have to sit down across the table, republican and democrat, as we did in 1983 between ronald reagan and tip o’neill. i know how to do that. i have a clear record of reaching across the aisle, whether it be joe lieberman or russ feingold or ted kennedy or others. that’s my clear record. we can work on nuclear power plants. build a whole bunch of them, create millions of new jobs. we have to have all of the above, alternative fuels, wind, tide, solar, natural gas, clean coal technology. all of these things we can do as americans and we can take on this mission and we can overcome it. "
30,MCCAIN,"my friends, some of this $700 billion ends up in the hands of terrorist organizations. as far as health care is concerned, obviously, everyone is struggling to make sure that they can afford their premiums and that they can have affordable and available health care. that’s the next issue. but we can do them all at once. there’s no — and we have to do them all at once. all three you mentioned are compelling national security requirements. "
31,BROKAW,"i’m trying to play by the rules that you all established. one minute for discussion. senator obama, if you would give us your list of priorities, there are some real questions about whether everything can be done at once. "
32,OBAMA,"we’re going to have to prioritize, just like a family has to prioritize. now, i’ve listed the things that i think have to be at the top of the list. energy we have to deal with today, because you’re paying $3.80 here in nashville for gasoline, and it could go up. and it’s a strain on your family budget, but it’s also bad for our national security, because countries like russia and venezuela and, you know, in some cases, countries like iran, are benefiting from higher oil prices. so we’ve got to deal with that right away. that’s why i’ve called for an investment of $15 billion a year over 10 years. our goal should be, in 10 year’s time, we are free of dependence on middle eastern oil. and we can do it. now, when jfk said we’re going to the moon in 10 years, nobody was sure how to do it, but we understood that, if the american people make a decision to do something, it gets done. so that would be priority number one. health care is priority number two, because that broken health care system is bad not only for families, but it’s making our businesses less competitive. and, number three, we’ve got to deal with education so that our young people are competitive in a global economy. but just one point i want to make, tom. senator mccain mentioned looking at our records. we do need to look at our records. senator mccain likes to talk about earmarks a lot. and that’s important. i want to go line by line through every item in the federal budget and eliminate programs that don’t work and make sure that those that do work, work better and cheaper. but understand this: we also have to look at where some of our tax revenues are going. so when senator mccain proposes a $300 billion tax cut, a continuation not only of the bush tax cuts, but an additional $200 billion that he’s going to give to big corporations, including big oil companies, $4 billion worth, that’s money out of the system. and so we’ve got to prioritize both our spending side and our tax policies to make sure that they’re working for you. that’s what i’m going to do as president of the united states. "
