,Speaker,Response
69,MCCAIN,"well, thank you for the question. you really identified one of the really major challenges that america faces. co-payments go up, costs go up, skyrocketing costs, which make people less and less able to afford health insurance in america. and we need to do all of the things that are necessary to make it more efficient. let’s put health records online, that will reduce medical errors, as they call them. let’s have community health centers. let’s have walk-in clinics. let’s do a lot of things to impose efficiencies. but what is at stake here in this health care issue is the fundamental difference between myself and senator obama. as you notice, he starts talking about government. he starts saying, government will do this and government will do that, and then government will, and he’ll impose mandates. if you’re a small business person and you don’t insure your employees, senator obama will fine you. will fine you. that’s remarkable. if you’re a parent and you’re struggling to get health insurance for your children, senator obama will fine you. i want to give every american a $5,000 refundable tax credit. they can take it anywhere, across state lines. why not? don’t we go across state lines when we purchase other things in america? of course it’s ok to go across state lines because in arizona they may offer a better plan that suits you best than it does here in tennessee. and if you do the math, those people who have employer-based health benefits, if you put the tax on it and you have what’s left over and you add $5,000 that you’re going to get as a refundable tax credit, do the math, 95 percent of the american people will have increased funds to go out and buy the insurance of their choice and to shop around and to get — all of those people will be covered except for those who have these gold-plated cadillac kinds of policies. you know, like hair transplants, i might need one of those myself. but the point is that we have got to give people choice in america and not mandate things on them and give them the ability. every parent i know would acquire health insurance for their children if they could. obviously small business people want to give their employees health insurance. of course they all want to do that. we’ve got to give them the wherewithal to do it. we can do it by giving them, as a start, a $5,000 refundable tax credit to go around and get the health insurance policy of their choice. "
70,BROKAW,"quick discussion. is health care in america a privilege, a right, or a responsibility? senator mccain? "
71,MCCAIN,"i think it’s a responsibility, in this respect, in that we should have available and affordable health care to every american citizen, to every family member. and with the plan that — that i have, that will do that. but government mandates i — i’m always a little nervous about. but it is certainly my responsibility. it is certainly small-business people and others, and they understand that responsibility. american citizens understand that. employers understand that. but they certainly are a little nervous when senator obama says, if you don’t get the health care policy that i think you should have, then you’re going to get fined. and, by the way, senator obama has never mentioned how much that fine might be. perhaps we might find that out tonight. "
72,OBAMA,"well, why don’t — why don’t — let’s talk about this, tom, because there was just a lot of stuff out there. "
73,BROKAW,"privilege, right or responsibility. let’s start with that. "
74,OBAMA,"well, i think it should be a right for every american. in a country as wealthy as ours, for us to have people who are going bankrupt because they can’t pay their medical bills — for my mother to die of cancer at the age of 53 and have to spend the last months of her life in the hospital room arguing with insurance companies because they’re saying that this may be a pre-existing condition and they don’t have to pay her treatment, there’s something fundamentally wrong about that. so let me — let me just talk about this fundamental difference. and, tom, i know that we’re under time constraints, but senator mccain through a lot of stuff out there. number one, let me just repeat, if you’ve got a health care plan that you like, you can keep it. all i’m going to do is help you to lower the premiums on it. you’ll still have choice of doctor. there’s no mandate involved. small businesses are not going to have a mandate. what we’re going to give you is a 50 percent tax credit to help provide health care for those that you need. now, it’s true that i say that you are going to have to make sure that your child has health care, because children are relatively cheap to insure and we don’t want them going to the emergency room for treatable illnesses like asthma. and when senator mccain says that he wants to provide children health care, what he doesn’t mention is he voted against the expansion of the children’s health insurance program that is responsible for making sure that so many children who didn’t have previously health insurance have it now. now, the final point i’ll make on this whole issue of government intrusion and mandates — it is absolutely true that i think it is important for government to crack down on insurance companies that are cheating their customers, that don’t give you the fine print, so you end up thinking that you’re paying for something and, when you finally get sick and you need it, you’re not getting it. and the reason that it’s a problem to go shopping state by state, you know what insurance companies will do? they will find a state — maybe arizona, maybe another state — where there are no requirements for you to get cancer screenings, where there are no requirements for you to have to get pre-existing conditions, and they will all set up shop there. that’s how in banking it works. everybody goes to delaware, because they’ve got very — pretty loose laws when it comes to things like credit cards. and in that situation, what happens is, is that the protections you have, the consumer protections that you need, you’re not going to have available to you. that is a fundamental difference that i have with senator mccain. he believes in deregulation in every circumstance. that’s what we’ve been going through for the last eight years. it hasn’t worked, and we need fundamental change. "
75,BROKAW,"senator, we want to move on now. if we’d come back to the hall here, we’re going to shift gears here a little bit and we’re going to go to foreign policy and international matters, if we can… "
76,MCCAIN,i don’t believe that — did we hear the size of the fine? 
77,BROKAW,"phil elliott (ph) is over here in this section, and phil elliott (ph) has a question for senator mccain. phil? question: yes. senator mccain, how will all the recent economic stress affect our nation’s ability to act as a peacemaker in the world? "
78,MCCAIN,"well, i thank you for that question, because there’s no doubt that history shows us that nations that are strong militarily over time have to have a strong economy, as well. and that is one of the challenges that america faces. but having said that, america — and we’ll hear a lot of criticism. i’ve heard a lot of criticism about america, and our national security policy, and all that, and much of that criticism is justified. but the fact is, america is the greatest force for good in the history of the world. my friends, we have gone to all four corners of the earth and shed american blood in defense, usually, of somebody else’s freedom and our own. "
79,MCCAIN,"so we are peacemakers and we’re peacekeepers. but the challenge is to know when the united states of american can beneficially effect the outcome of a crisis, when to go in and when not, when american military power is worth the expenditure of our most precious treasure. and that question can only be answered by someone with the knowledge and experience and the judgment, the judgment to know when our national security is not only at risk, but where the united states of america can make a difference in preventing genocide, in preventing the spread of terrorism, in doing the things that the united states has done, not always well, but we’ve done because we’re a nation of good. and i am convinced that my record, going back to my opposition from sending the marines to lebanon, to supporting our efforts in kosovo and bosnia and the first gulf war, and my judgment, i think, is something that i’m — a record that i’m willing to stand on. senator obama was wrong about iraq and the surge. he was wrong about russia when they committed aggression against georgia. and in his short career, he does not understand our national security challenges. we don’t have time for on-the-job training, my friends. "
80,BROKAW,"senator obama, the economic constraints on the u.s. military action around the world. "
81,OBAMA,"well, you know, senator mccain, in the last debate and today, again, suggested that i don’t understand. it’s true. there are some things i don’t understand. i don’t understand how we ended up invading a country that had nothing to do with 9/11, while osama bin laden and al qaeda are setting up base camps and safe havens to train terrorists to attack us. that was senator mccain’s judgment and it was the wrong judgment. when senator mccain was cheerleading the president to go into iraq, he suggested it was going to be quick and easy, we’d be greeted as liberators. that was the wrong judgment, and it’s been costly to us. so one of the difficulties with iraq is that it has put an enormous strain, first of all, on our troops, obviously, and they have performed heroically and honorably and we owe them an extraordinary debt of gratitude. but it’s also put an enormous strain on our budget. we’ve spent, so far, close to $700 billion and if we continue on the path that we’re on, as senator mccain is suggesting, it’s going to go well over $1 trillion. we’re spending $10 billion a month in iraq at a time when the iraqis have a $79 billion surplus, $79 billion. and we need that $10 billion a month here in the united states to put people back to work, to do all these wonderful things that senator mccain suggested we should be doing, but has not yet explained how he would pay for. now, senator mccain and i do agree, this is the greatest nation on earth. we are a force of good in the world. but there has never been a nation in the history of the world that saw its economy decline and maintained its military superiority. and the strains that have been placed on our alliances around the world and the respect that’s been diminished over the last eight years has constrained us being able to act on something like the genocide in darfur, because we don’t have the resources or the allies to do everything that we should be doing. that’s going to change when i’m president, but we can’t change it unless we fundamentally change senator mccain’s and george bush’s foreign policy. it has not worked for america. "
82,BROKAW,"senator obama, let me ask you if — let’s see if we can establish tonight the obama doctrine and the mccain doctrine for the use of united states combat forces in situations where there’s a humanitarian crisis, but it does not affect our national security. take the congo, where 4.5 million people have died since 1998, or take rwanda in the earlier dreadful days, or somalia. what is the obama doctrine for use of force that the united states would send when we don’t have national security issues at stake? "
83,OBAMA,"well, we may not always have national security issues at stake, but we have moral issues at stake. if we could have intervened effectively in the holocaust, who among us would say that we had a moral obligation not to go in? if we could’ve stopped rwanda, surely, if we had the ability, that would be something that we would have to strongly consider and act. so when genocide is happening, when ethnic cleansing is happening somewhere around the world and we stand idly by, that diminishes us. "
84,OBAMA,"and so i do believe that we have to consider it as part of our interests, our national interests, in intervening where possible. but understand that there’s a lot of cruelty around the world. we’re not going to be able to be everywhere all the time. that’s why it’s so important for us to be able to work in concert with our allies. let’s take the example of darfur just for a moment. right now there’s a peacekeeping force that has been set up and we have african union troops in darfur to stop a genocide that has killed hundreds of thousands of people. we could be providing logistical support, setting up a no-fly zone at relatively little cost to us, but we can only do it if we can help mobilize the international community and lead. and that’s what i intend to do when i’m president. "
85,BROKAW,"senator mccain, the mccain doctrine, if you will. "
86,MCCAIN,"well, let me just follow up, my friends. if we had done what senator obama wanted done in iraq, and that was set a date for withdrawal, which general petraeus, our chief — chairman of our joint chiefs of staff said would be a very dangerous course to take for america, then we would have had a wider war, we would have been back, iranian influence would have increased, al qaeda would have re- established a base. there was a lot at stake there, my friends. and i can tell you right now that senator obama would have brought our troops home in defeat. i’ll bring them home with victory and with honor and that is a fundamental difference. the united states of america, tom, is the greatest force for good, as i said. and we must do whatever we can to prevent genocide, whatever we can to prevent these terrible calamities that we have said never again. but it also has to be tempered with our ability to beneficially affect the situation. that requires a cool hand at the tiller. this requires a person who understands what our — the limits of our capability are. we went in to somalia as a peacemaking organization, we ended up trying to be — excuse me, as a peacekeeping organization, we ended up trying to be peacemakers and we ended up having to withdraw in humiliation. in lebanon, i stood up to president reagan, my hero, and said, if we send marines in there, how can we possibly beneficially affect this situation? and said we shouldn’t. unfortunately, almost 300 brave young marines were killed. so you have to temper your decisions with the ability to beneficially affect the situation and realize you’re sending america’s most precious asset, american blood, into harm’s way. and, again, i know those situations. i’ve been in them all my life. and i can tell you right now the security of your young men and women who are serving in the military are my first priority right after our nation’s security. and i may have to make those tough decisions. but i won’t take them lightly. and i understand that we have to say never again to a holocaust and never again to rwanda. but we had also better be darn sure we don’t leave and make the situation worse, thereby exacerbating our reputation and our ability to address crises in other parts of the world. "
87,BROKAW,"senator mccain, thank you very much. next question for senator obama, it comes from the f section and is from katie hamm (ph). katie? question: should the united states respect pakistani sovereignty and not pursue al qaeda terrorists who maintain bases there, or should we ignore their borders and pursue our enemies like we did in cambodia during the vietnam war? "
88,OBAMA,"katie, it’s a terrific question and we have a difficult situation in pakistan. i believe that part of the reason we have a difficult situation is because we made a bad judgment going into iraq in the first place when we hadn’t finished the job of hunting down bin laden and crushing al qaeda. so what happened was we got distracted, we diverted resources, and ultimately bin laden escaped, set up base camps in the mountains of pakistan in the northwest provinces there. they are now raiding our troops in afghanistan, destabilizing the situation. they’re stronger now than at any time since 2001. and that’s why i think it’s so important for us to reverse course, because that’s the central front on terrorism. they are plotting to kill americans right now. as secretary gates, the defense secretary, said, the war against terrorism began in that region and that’s where it will end. so part of the reason i think it’s so important for us to end the war in iraq is to be able to get more troops into afghanistan, put more pressure on the afghan government to do what it needs to do, eliminate some of the drug trafficking that’s funding terrorism. but i do believe that we have to change our policies with pakistan. we can’t coddle, as we did, a dictator, give him billions of dollars and then he’s making peace treaties with the taliban and militants. "
89,OBAMA,"what i’ve said is we’re going to encourage democracy in pakistan, expand our nonmilitary aid to pakistan so that they have more of a stake in working with us, but insisting that they go after these militants. and if we have osama bin laden in our sights and the pakistani government is unable or unwilling to take them out, then i think that we have to act and we will take them out. we will kill bin laden; we will crush al qaida. that has to be our biggest national security priority. "
90,BROKAW,senator mccain? 
91,MCCAIN,"well, katie (ph), thank you. you know, my hero is a guy named teddy roosevelt. teddy roosevelt used to say walk softly — talk softly, but carry a big stick. senator obama likes to talk loudly. in fact, he said he wants to announce that he’s going to attack pakistan. remarkable. you know, if you are a country and you’re trying to gain the support of another country, then you want to do everything you can that they would act in a cooperative fashion. when you announce that you’re going to launch an attack into another country, it’s pretty obvious that you have the effect that it had in pakistan: it turns public opinion against us. now, let me just go back with you very briefly. we drove the russians out with — the afghan freedom fighters drove the russians out of afghanistan, and then we made a most serious mistake. we washed our hands of afghanistan. the taliban came back in, al qaida, we then had the situation that required us to conduct the afghan war. now, our relations with pakistan are critical, because the border areas are being used as safe havens by the taliban and al qaida and other extremist organizations, and we have to get their support. now, general petraeus had a strategy, the same strategy — very, very different, because of the conditions and the situation — but the same fundamental strategy that succeeded in iraq. and that is to get the support of the people. we need to help the pakistani government go into waziristan, where i visited, a very rough country, and — and get the support of the people, and get them to work with us and turn against the cruel taliban and others. and by working and coordinating our efforts together, not threatening to attack them, but working with them, and where necessary use force, but talk softly, but carry a big stick. "
92,OBAMA,"tom, just a… "
93,BROKAW,senator mccain… 
94,OBAMA,… just a quick follow-up on this. i think… 
95,MCCAIN,"if we’re going to have follow-ups, then i will want follow-ups, as well. "
96,BROKAW,"no, i know. so but i think we get at it… "
97,MCCAIN,it’d be fine with me. it’d be fine with me. 
98,BROKAW,"… if i can, with this question. "
99,OBAMA,then let’s have one. 
100,BROKAW,"all right, let’s have a follow-up. "
101,MCCAIN,it’d be fine with me. 
102,OBAMA,"just — just — just a quick follow-up, because i think — i think this is important. "
103,BROKAW,"i’m just the hired help here, so, i mean… (laughter) "
104,OBAMA,"you’re doing a great job, tom. look, i — i want to be very clear about what i said. nobody called for the invasion of pakistan. senator mccain continues to repeat this. what i said was the same thing that the audience here today heard me say, which is, if pakistan is unable or unwilling to hunt down bin laden and take him out, then we should. now, that i think has to be our policy, because they are threatening to kill more americans. now, senator mccain suggests that somehow, you know, i’m green behind the ears and, you know, i’m just spouting off, and he’s somber and responsible. "
105,MCCAIN,thank you very much. 
106,OBAMA,"senator mccain, this is the guy who sang, “bomb, bomb, bomb iran,” who called for the annihilation of north korea. that i don’t think is an example of “speaking softly.” this is the person who, after we had — we hadn’t even finished afghanistan, where he said, “next up, baghdad.” so i agree that we have to speak responsibly and we have to act responsibly. and the reason pakistan — the popular opinion of america had diminished in pakistan was because we were supporting a dictator, musharraf, had given him $10 billion over seven years, and he had suspended civil liberties. we were not promoting democracy. this is the kind of policies that ultimately end up undermining our ability to fight the war on terrorism, and it will change when i’m president. "
107,MCCAIN,"and, tom, if — if we’re going to go back and forth, i then — i’d like to have equal time to go — to respond to… "
108,BROKAW,"yes, you get the… "
109,MCCAIN,… to — to — to… 
110,BROKAW,"… last word here, and then we have to move on. "
111,MCCAIN,"not true. not true. i have, obviously, supported those efforts that the united states had to go in militarily and i have opposed that i didn’t think so. i understand what it’s like to send young american’s in harm’s way. i say — i was joking with a veteran — i hate to even go into this. i was joking with an old veteran friend, who joked with me, about iran. but the point is that i know how to handle these crises. and senator obama, by saying that he would attack pakistan, look at the context of his words. i’ll get osama bin laden, my friends. i’ll get him. i know how to get him. i’ll get him no matter what and i know how to do it. but i’m not going to telegraph my punches, which is what senator obama did. and i’m going to act responsibly, as i have acted responsibly throughout my military career and throughout my career in the united states senate. and we have fundamental disagreements about the use of military power and how you do it, and you just saw it in response to previous questions. "
112,BROKAW,"can i get a quick response from the two of you about developments in afghanistan this week? the senior british military commander, who is now leading there for a second tour, and their senior diplomatic presence there, sherard cowper-coles, who is well known as an expert in the area, both have said that we’re failing in afghanistan. the commander said we cannot win there. we’ve got to get it down to a low level insurgency, let the afghans take it over. cowper-coles said what we need is an acceptable dictator. if either of you becomes president, as one of you will, how do you reorganize afghanistan’s strategy or do you? briefly, if you can. "
113,OBAMA,"i’ll be very brief. we are going to have to make the iraqi government start taking more responsibility, withdraw our troops in a responsible way over time, because we’re going to have to put some additional troops in afghanistan. general mckiernan, the commander in afghanistan right now, is desperate for more help, because our bases and outposts are now targets for more aggressive afghan — taliban offenses. we’re also going to have to work with the karzai government, and when i met with president karzai, i was very clear that, “you are going to have to do better by your people in order for us to gain the popular support that’s necessary.” i don’t think he has to be a dictator. and we want a democracy in afghanistan. but we have to have a government that is responsive to the afghan people, and, frankly, it’s just not responsive right now. "
114,BROKAW,"senator mccain, briefly. "
115,MCCAIN,"general petraeus has just taken over a position of responsibility, where he has the command and will really set the tone for the strategy and tactics that are used. and i’ve had conversations with him. it is the same overall strategy. of course, we have to do some things tactically, some of which senator obama is correct on. we have to double the size of the afghan army. we have to have a streamlined nato command structure. we have to do a lot of things. we have to work much more closely with the pakistanis. but most importantly, we have to have the same strategy, which senator obama said wouldn’t work, couldn’t work, still fails to admit that he was wrong about iraq. he still will not admit that he was wrong about the strategy of the surge in iraq, and that’s the same kind of strategy of go out and secure and hold and allow people to live normal lives. and once they feel secure, then they lead normal, social, economic, political lives, the same thing that’s happening in iraq today. so i have confidence that general petraeus, working with the pakistanis, working with the afghans, doing the same job that he did in iraq, will again. we will succeed and we will bring our troops home with honor and victory and not in defeat. "
