,Speaker,Response
29,MR. KENNEDY,"well number one on indochina, mr. nixon talked in – before the newspaper editors in the spring of 1954 about putting, and i quote him, “american boys into indochina.” the reason indochina was preserved was the result of the geneva conference which indochina. number two, on the question of the u-2 flights. i thought the. u-2 flight in may just before the conference was a mistake in timing because of the hazards involved, if the summit conference had any hope for success. i never criticized the u-2 flights in general, however. i never suggested espionage should stop. it still goes on, i would assume, on both sides. number three, the vice president – on may fifteenth after the u-2 flight – indicated that the flights were going on, even though the administration and the president had canceled the flights on may twelfth. number three, the pre – vice president suggests that we should keep the communists in doubt about whether we would fight on quemoy and matsu. that’s not the position he’s taking. he’s indicating that we should fight for these islands come what may because they are, in his words, in the area of freedom. he didn’t take that position on tibet. he didn’t take that position on budapest. he doesn’t take that position that i’ve seen so far in laos. guinea and ghana have both moved within the soviet sphere of influence in foreign policy; so has cuba. i merely say that the united states should meet its commitments to que- to uh – formosa and the pescadores. but as admiral yarnell has said, and he’s been supported by most military authority, these islands that we’re now talking about are not worth the bones of a single american soldier; and i know how difficult it is to sustain troops close to the shore under artillery bombardment. and therefore, i think, we should make it very clear the disagreement between mr. nixon and myself. he’s extending the administration’s commitment. "
30,MR. SHADEL,mr. drummond’s question is for senator kennedy. 
31,MR. DRUMMOND,"uh – mr. kennedy, representative adam clayton powell, in the course of his speaking tour in your behalf, is saying, and i quote: “the ku klux klan is riding again in this campaign. if it doesn’t stop, all bigots will vote for nixon and all right-thinking christians and jews will vote for kennedy rather than be found in the ranks of the klan-minded.” end quotation. governor michael disalle is saying much the same thing. what i would like to ask, senator kennedy, is what is the purpose of this sort of thing and how do you feel about it? "
32,MR. KENNEDY,"well the que- the – mr. griffin, i believe, who is the head of the klan, who lives in tampa, florida, indicated a – in a statement, i think, two or three weeks ago that he was not going to vote for me, and that he was going to vote for mr. nixon. i do not suggest in any way, nor have i ever, that that indicates that mr. nixon has the slightest sympathy, involvement, or in any way imply any inferences in regard to the ku klux klan. that’s absurd. i don’t suggest that, i don’t support it. i would disagree with it. mr. nixon knows very well that in this – in this whole matter that’s been involved with the so-called religious discussion in this campaign, i’ve never suggested, even by the vaguest implication, that he did anything but disapprove it. and that’s my view now. i disapprove of the issue. i do not suggest that mr. nixon does in any way. "
33,MR. SHADEL,mr. vice president. 
34,MR. NIXON,"well i welcome this opportunity to join senator kennedy completely on that statement and to say before this largest television audience in history something that i have been saying in the past and want to – will always say in the future. on our last television debate, i pointed out that it was my position that americans must choose the best man that either party could produce. we can’t settle for anything but the best. and that means, of course, the best man that this nation can produce. and that means that we can’t have any test of religion. we can’t have any test of race. it must be a test of a man. also as far as religion is concerned. i have seen communism abroad. i see what it does. communism is the enemy of all religions; and we who do believe in god must join together. we must not be divided on this issue. the worst thing that i can think can happen in this campaign would be for it to be decided on religious issues. i obviously repudiate the klan; i repudiate anybody who uses the religious issue; i will not tolerate it, i have ordered all of my people to have nothing to do with it and i say – say to this great audience, whoever may be listening, remember, if you believe in america, if you want america to set the right example to the world, that we cannot have religious or racial prejudice. we cannot have it in our hearts. but we certainly cannot have it in a presidential campaign. "
35,MR. SHADEL,"mr. mcgee has a question for vice president nixon. mr. mcgee: mr. vice president, some of your early campaign literature said you were making a study to see if new laws were needed to protect the public against excessive use of power by labor unions. have you decided whether such new laws are needed, and, if so, what would they do? "
36,MR. NIXON,"mr. mcgee, i am planning a speech on that subject next week. uh – also, so that we can get the uh – opportunity for the questioners to question me, it will be before the next television debate. uh – i will say simply, in advance of it, that i believe that in this area, the laws which should be passed uh – as far as the big national emergency strikes are concerned, are ones that will give the president more weapons with which to deal with those strikes. now, i have a basic disagreement with senator kennedy, though, on this point. he has taken the position, when he first indicated in october of last year, that he would even favor compulsory arbitration as one of the weapons the president might have to stop a national emergency strike. i understand in his last speech before the steelworkers union, that he changed that position and indicated that he felt that government seizure might be the best way to stop a strike which could not be settled by collective bargaining. i do not believe we should have either compulsory arbitration or seizure. i think the moment that you give to the union, on the one side, and to management, on the other side, the escape hatch of eventually going to government to get it settled, that most of these great strikes will end up being settled by government, and that will be a – be in the end, in my opinion, wage control; it would mean price control – all the things that we do not want. i do believe, however, that we can give to the president of the united states powers, in addition to what he presently has in the fact finding area, which would enable him to be more effective than we have been in handling these strikes. one last point i should make. the record in handling them has been very good during this administration. we have had less man-hours lost by strikes in these last seven years than we had in the previous seven years, by a great deal. and i only want to say that however good the record is, it’s got to be better. because in this critical year – period of the sixties we’ve got to move forward, all americans must move forward together, and we have to get the greatest cooperation possible between labor and management. we cannot afford stoppages of massive effect on the economy when we’re in the terrible competition we’re in with the soviets. "
37,MR. SHADEL,"senator, your comment. "
38,MR. KENNEDY,"well, i always have difficulty recognizing my positions when they’re stated by the vice president. i never suggested that compulsory arbitration was the solution for national emergency disputes. i’m opposed to that, was opposed to it in october, 1958. i have suggested that the president should be given other weapons to protect the national interest in case of national emergency strikes beyond the injunction provision of the taft-hartley act. i don’t know what other weapons the vice president is talking about. i’m talking about giving him four or five tools – not only the fact-finding committee that he now has under the injunction provision, not only the injunction, but also the power of the fact-finding commission to make recommendations – recommendations which would not be binding, but nevertheless would have great force of public opinion behind them. one of the additional powers that i would suggest would be seizure. there might be others. by the president having five powers – four or five powers – and he only has very limited powers today, neither the company nor the union would be sure which power would be used; and therefore, there would be a greater incentive on both sides to reach an agreement themselves without taking it to the government. the difficulty now is the president’s course is quite limited. he can set up a fact-finding committee. the fact-finding committee’s powers are limited. he can provide an injunction if there’s a national emergency for eighty days, then the strike can go on; and there are no other powers or actions that the president could take unless he went to the congress. this is a difficult and sensitive matter. but to state my view precisely, the president should have a variety of things he could do. he could leave the parties in doubt as to which one he would use; and therefore there would be incentive, instead of as now – the steel companies were ready to take the strike because they felt the injunction of eighty days would break the union, which didn’t happen. "
39,MR. SHADEL,"the next question is by mr. cater for senator kennedy. mr. cater: uh – mr. kennedy, uh – senator – uh – vice president nixon says that he has costed the two party platforms and that yours would run at least ten billion dollars a year more than his. you have denied his figures. he has called on you to supply your figures. would you do that? "
40,MR. KENNEDY,"yes, i have stated in both uh – debates and state again that i believe in a balanced budget and have supported that concept during my fourteen years in the congress. the only two times when an unbalanced budget is warranted would be during a serious recession – and we had that in fifty-eight in an unbalanced budget of twelve billion dollars – or a national emergency where there should be large expenditures for national defense, which we had in world war ii and uh – during part of the korean war. on the question of the cost of our budget, i have stated that it’s my best judgment that our agricultural program will cost a billion and a half, possibly two billion dollars less than the present agricultural program. my judgment is that the program the vice president put forward, which is an extension of mr. benson’s program, will cost a billion dollars more than the present program, which costs about six billion dollars a year, the most expensive in history. we’ve spent more money on agriculture in the last eight years than the hundred years of the agricultural department before that. secondly, i believe that the high interest-rate policy that this administration has followed has added about three billion dollars a year to interest on the debt – merely funding the debt – which is a burden an the taxpayers. i would hope, under a different monetary policy, that it would be possible to reduce that interest-rate burden, at least a billion dollars. third, i think it’s possible to gain a seven hundred million to a billion dollars through tax changes which i believe would close up loof- loopholes on dividend withholding, on expense accounts. fourthly, i have suggested that the medical care for the aged – and the bill which the congress now has passed and the president signed if fully implemented would cost a billion dollars on the treasury – out of treasury funds and a billion dollars by the states – the proposal that i have put forward and which many of the members of my party support is for medical care financed under social security; which would be financed under the social security taxes; which is less than three cents a day per person for medical care, doctors’ bills, nurses, hospitals, when they retire. it is actuarially sound. so in my judgment we would spend more money in this administration on aid to education, we’d spend more money on housing, we’d spend more money and i hope more wisely on defense than this administration has. but i believe that the next administration should work for a balanced budget, and that would be my intention. mr. nixon misstates my figures constantly, which uh – is of course his right, but the fact of the matter is: here is where i stand and i just want to have it on the public record. "
41,MR. SHADEL,mr. vice president? 
42,MR. NIXON,"senator kennedy has indicated on several occasions in this program tonight that i have been misstating his record and his figures. i will issue a white paper after this broadcast, quoting exactly what he said on compulsory arbitration, for example, and the record will show that i have been correct. now as far as his figures are concerned here tonight, he again is engaging in this, what i would call, mirror game of “here-it-is-and-here-it-isn’t.” uh – on the one hand, for example, he suggests that as far as his medical care program is concerned that that really isn’t a problem because it’s from social security. but social security is a tax. the people pay it. it comes right out of your paycheck. this doesn’t mean that the people aren’t going to be paying the bill. he also indicates as far as his agricultural program is concerned that he feels it will cost less than ours. well, all that i can suggest is that all the experts who have studied the program indicate that it is the most fantastic program, the worst program, insofar as its effect on the farmers, that the – america has ever had foisted upon it in an election year or any other time. and i would also point out that senator kennedy left out a part of the cost of that program – a twenty-five percent rise in food prices that the people would have to pay. now are we going to have that when it isn’t going to help the farmers? i don’t think we should have that kind of a program. then he goes on to say that he’s going to change the interest-rate situation and we’re going to get some more money that way. well, what he is saying there in effect, we’re going to have inflation. we’re going to go right back to what we had under mr. truman when he had political control of the federal reserve board. i don’t believe we ought to pay our bills through inflation, through a phony interest rate. "
43,MR. SHADEL,"next, mr. drummond’s question for vice president nixon. "
44,MR. DRUMMOND,"uh – mr. nixon uh – before the convention you and governor rockefeller said jointly that the nation’s economic growth ought to be accelerated; and the republican platform states that uh – the nation needs to quicken the pace of economic growth. uh – is it fair, therefore, mr. vice president, to conclude that you feel that there has been insufficient economic growth during the past eight years; and if so, what would you do beyond uh – present administration policies uh – to step it up? "
45,MR. NIXON,"mr. drummond, i am never satisfied with the economic growth of this country. i’m not satisfied with it even if there were no communism in the world, but particularly when we’re in the kind of a race we’re in, we have got to see that america grows just as fast as we can, provided we grow soundly. because even though we have maintained, as i pointed out in our first debate, the absolute gap over the soviet union; even though the growth in this administration has been twice as much as it was in the truman administration; that isn’t good enough. because america must be able to grow enough not only to take care of our needs at home for better education and housing and health – all these things we want. we’ve got to grow enough to maintain the forces that we have abroad and to wage the non-military battle for the war – uh – for the world in asia, in africa and latin america. it’s going to cost more money, and growth will help us to win that battle. now, what do we do about it? and here i believe basically that what we have to do is to stimulate that sector of america, the private enterprise sector of the economy, in which there is the greatest possibility for expansion. so that is why i advocate a program of tax reform which will stimulate more investment in our economy. in addition to that, we have to move on other areas that are holding back growth. i refer, for example, to distressed areas. we have to move into those areas with programs so that we make adequate use of the resources of those areas. we also have to see that all of the people of the united states – the tremendous talents that our people have – are used adequately. that’s why in this whole area of civil rights, the equality of opportunity for employment and education is not just for the benefit of the minority groups, it’s for the benefit of the nation so that we can get the scientists and the engineers and all the rest that we need. and in addition to that, we need programs, particularly in higher education, which will stimulate scientific breakthroughs which will bring more growth. now what all this, of course, adds up to is this: america has not been standing still. let’s get that straight. anybody who says america’s been standing still for the last seven and a half years hasn’t been traveling around america. he’s been traveling in some other country. we have been moving. we have been moving much faster than we did in the truman years. but we can and must move faster, and that’s why i stand so strongly for programs that will move america forward in the sixties, move her forward so that we can stay ahead of the soviet union and win the battle for freedom and peace. "
46,MR. SHADEL,senator kennedy. 
47,MR. KENNEDY,"well first may i correct a statement which was made before, that under my agricultural program food prices would go up twenty-five percent. that’s untrue. the fa- the farmer who grows wheat gets about two and a half cents out of a twenty-five-cent loaf of bread. even if you put his income up ten percent, that would be two and three-quarters percent three pers- or three cents out of that twenty-five cents. the t- man who grows tomatoes – it costs less for those tomatoes than it does for the label on the can. and i believe when the average hour for many farmers’ wage is about fifty cents an hour, he should do better. but anybody who suggests that that program would c- come to any figure indicated by the vice president is in error. the vice president suggested a number of things. he suggested that we aid distressed areas. the administration has vetoed that bill passed by the congress twice. he suggested we pass an aid to education bill. but the administration and the republican majority in the congress has opposed any realistic aid to education. and the vice president cast the deciding vote against federal aid for teachers’ salaries in the senate, which prevented that being added. this administration and this country last year had the lowest rate of economic growth – which means jobs – of any major industrialized society in the world in 1959. and when we have to find twenty-five thousand new jobs a week for the next ten years, we’re going to have to grow more. governor rockefeller says five per cent. the democratic platform and others say five per cent. many say four and a half per cent. the last eight years the average growth has been about two and a half per cent. that’s why we don’t have full employment today. "
48,MR. SHADEL,"mr. mcgee has the next question for senator kennedy. mr. mcgee: uh – senator kennedy, a moment ago you mentioned tax loopholes. now your running mate, senator lyndon johnson, is from texas, an oil-producing state and one that many political leaders feel is in doubt in this election year. and reports from there say that oil men in texas are seeking assurance from senator johnson that the oil depletion allowance will not be cut. the democratic platform pledges to plug holes in the tax laws and refers to inequitable depletion allowance as being conspicuous loopholes. my question is, do you consider the twenty-seven and a half per cent depletion allowance inequitable, and would you ask that it be cut? "
49,MR. KENNEDY,"uh – mr. mcgee, there are about a hundred and four commodities that have some kind of depletion allowance – different kind of minerals, including oil. i believe all of those should be gone over in detail to make sure that no one is getting a tax break; to make sure that no one is getting away from paying the taxes he ought to pay. that includes oil; it includes all kinds of minerals; it includes everything within the range of taxation. we want to be sure it’s fair and equitable. it includes oil abroad. perhaps that oil abroad should be treated differently than the oil here at home. now the oil industry recently has had hard times. particularly some of the smaller producers. they’re moving about eight or nine days in texas. but i can assure you that if i’m elected president, the whole spectrum of taxes will be gone through carefully. and if there is any inequities in oil or any other commodity, then i would vote to close that loophole, i have voted in the past to reduce the depletion allowance for the largest producers; for those from five million dollars down, to maintain it at twenty-seven and a half per cent. i believe we should study this and other allowances; tax expense, dividend expenses and all the rest, and make a determination of how we can stimulate growth; how we can provide the revenues needed to move our country forward. "
50,MR. SHADEL,mr. vice president. 
51,MR. NIXON,"senator kennedy’s position and mine completely different on this. i favor the present depletion allowance. i favor it not because i want to make a lot of oil men rich, but because i want to make america rich. why do we have a depletion allowance? because this is the stimulation, the incentive for companies to go out and explore for oil, to develop it. if we didn’t have a depletion allowance of certainly, i believe, the present amount, we would have our oil exploration cut substantially in this country. now, as far as my position then is concerned, it is exactly opposite to the senator’s. and it’s because of my belief that if america is going to have the growth that he talks about and that i talk about and that we want, the thing to do is not to discourage individual enterprise, not to discourage people to go out and discover more oil and minerals, but to encourage them. and so he would be doing exactly the wrong thing. one other thing. he suggests that there are a number of other items in this whole depletion field that could be taken into account. he also said a moment ago that we would get more money to finance his programs by revising the tax laws, including depletion. i should point out that as far as depletion allowances are concerned, the oil depletion allowance is one that provides eighty percent of all of those involved in depletion, so you’re not going to get much from revenue insofar as depletion allowances are concerned, unless you move in the area that he indicated. but i oppose it. i oppose it for the reasons that i mentioned. i oppose it because i want us to have more oil exploration and not less. "
52,MR. SHADEL,"gentlemen, if i may remind you, time is growing short, so please keep your questions and answers as brief as possible consistent with clarity. mr. von fremd for vice president nixon. "
53,MR. VON FREMD,"mr. vice president, in the past three years, there has been an exodus of more than four billion dollars of gold from the united states, apparently for two reasons: because exports have slumped and haven’t covered imports, and because of increased american investments abroad. if you were president, how would you go about stopping this departure of gold from our shores? "
